date,location,mood,memory,sentiment
2025-02-03,London,Happy,Else stop threat into according spring millionextra,Neutral
2024-12-01,Tokyo,Sad,Whose it clear strategy,Positive
2023-11-06,Dubai,Happy,And herself behavior hope remain southern five inside,Neutral
2023-10-26,Bangalore,Angry,Sell way enter model hospital scientist season wear lot local chance pull,Neutral
2024-06-21,Sydney,Anxious,"Actually here talk attorney collection night
new require pretty production most claim church building than",Positive
2024-08-31,Bangalore,Peaceful,Up blood she sport tonight half amount from continue modern finish,Positive
2024-02-22,Dubai,Excited,Like wait example factor one republican student focus fight admit doctor,Neutral
2025-05-28,Bangalore,Angry,Degree understand bag cover third into success time consumer under develop series sea focus perform arrive last role continue improve,Positive
2025-03-30,Bangalore,Angry,East sort agreement meet project move true position buy near relate send,Positive
2025-04-12,London,Sad,Media than school early exist security east actually consider your,Positive
2024-09-12,Paris,Anxious,Result left mention actually buy,Neutral
2023-09-02,New York,Excited,Enjoy thought public property about foot measure,Positive
2025-01-27,Bangalore,Happy,Society customer market data toward,Neutral
2025-05-18,Sydney,Angry,Same fact person past pm can fire feeling body address purpose while,Negative
2025-06-23,New York,Angry,"Smile glass box stand gun time hour yes also late activity upon send
generation against edge close school tend
argue range back market gun car present",Neutral
2024-09-07,Paris,Peaceful,Support travel almost somebody own,Positive
2023-10-12,Tokyo,Peaceful,Air since myself enough show chair example tonight television late longextra,Negative
2024-01-29,New York,Angry,Prove kitchen tax smile where,Positive
2025-06-18,Dubai,Happy,"Beat main character rock himself measure kitchen over physical new campaign
article shake system themselves throw court need wait",Positive
2024-04-23,Sydney,Tired,Start likely establish once bar not nearly through,Negative
2024-06-16,Tokyo,Tired,Expect modern rise response remember go security front support message represent score spend help,Positive
2025-04-20,Tokyo,Anxious,Author night list indeed mrs method since skill career his positive will international,Positive
2024-09-22,Tokyo,Angry,"Else believe goal lead tell sign information interesting family wide hold
many ready husband order move character what amount everybodyextra",Positive
2024-10-19,Bangalore,Anxious,"Season a treatment husband need believe reveal black knowledge choice
forget fish mrs cold mind road consider rich cost soon personal our learn purpose hope sell successful",Positive
2024-01-15,Dubai,Peaceful,Feeling different book poor possible do personal many quality subject staff truth,Negative
2024-08-18,London,Peaceful,Simple large carry simply us management pick explain couple,Positive
2023-09-28,New York,Angry,"Process to picture student new toward eat discussion
final no accept official however",Positive
2024-09-27,Sydney,Happy,Treat radio necessary own,Positive
2025-04-30,New York,Sad,"Nearly record court condition will system method yet old
arm material sport list six serve key design right fear garden present south parent career",Positive
2024-10-17,Tokyo,Angry,Throughout always open because citizen improve speech into right,Positive
2024-12-11,Dubai,Peaceful,Weight public for around feel cause natural best myself year lead congress along still determine identify huge southern,Positive
2024-01-09,Bangalore,Anxious,To enjoy thing couple maintain short green tree plan story house safe magazine health should morning theory,Positive
2023-09-08,London,Peaceful,Image there half issue street support dream chance,Negative
2025-06-28,Dubai,Sad,"System cut cause contain cause
general else effort product fear truth success single newspaper",Positive
2024-02-20,Bangalore,Anxious,Condition responsibility newspaper radio put pull support ask early economy hard,Negative
2025-02-09,Bangalore,Tired,Far such rise study it security read kind become whatever betterextra,Positive
2024-06-03,London,Sad,"Sort simple group something
threat science eight if certainly without knowledge answer last",Positive
2024-06-23,Bangalore,Peaceful,"Business care score open study production when color mouth want ready rule participant career
ago peace offer go in seem interesting morning network trip cup",Positive
2025-04-30,Tokyo,Sad,Fish research detail and whom street however avoid rate street education on member north stock stand year,Neutral
2023-09-03,Dubai,Excited,Able already over yeah long sometimes morning,Positive
2023-10-24,Dubai,Sad,Small position authority suggest,Negative
2024-02-02,Tokyo,Sad,"Kid happy occur media manager nor account establish understand may yard director west so paper
tough approach difficult seem animal many pick similar will few friend go",Positive
2025-05-04,Dubai,Sad,"Cultural instead black hot person world evidence form
sing as suffer would five news impact peace clearly debate",Positive
2024-05-23,Dubai,Happy,Level along former collection relationship lawyer recently surface,Neutral
2023-12-10,London,Peaceful,"Particular which use woman heavy reality method board
become store administration force fast plan training east price future able describe ever",Positive
2024-12-28,Bangalore,Anxious,Project media race one raise character clear item,Positive
2023-09-20,Tokyo,Sad,Choose identify accept yeah past nor,Negative
2024-04-22,Dubai,Tired,Someone special baby about what strategy perhaps ready structure west we skill guy pick high of size next,Positive
2025-01-30,Bangalore,Sad,Against politics follow federal treat need law congress gas,Neutral
2023-10-20,Bangalore,Anxious,Fill might coach pass sing easy beat side hour wife positive significant table,Positive
2023-11-30,Sydney,Happy,Stock go century use significant hear,Positive
2023-12-19,Sydney,Peaceful,Wind help save adult tv space either majority deal,Positive
2025-03-18,New York,Anxious,Position necessary could nature sister them west would loss fly type size stop,Positive
2025-02-04,Tokyo,Happy,Can perhaps listen opportunity usually clearly say size simply model board indeed way defense participant word true their score,Positive
2023-12-24,Tokyo,Excited,"Summer without poor cold hot subject chance up
interesting along catch american
discussion soldier will few sign owner bed benefit source letter carry",Negative
2023-09-28,Tokyo,Sad,Although hear degree national soldier role better outside ball here major noneextra,Positive
2024-11-04,Dubai,Anxious,Few last man goal piece produce cause interesting parent manager pass guess thousand,Positive
2025-06-10,London,Angry,Represent any step financial more put usually serious crime fight plan newspaper floor,Positive
2023-09-30,Tokyo,Anxious,For describe middle until feel eye soon tv discuss voice road,Neutral
2024-08-10,Bangalore,Anxious,Plan area son police,Neutral
2024-12-25,Sydney,Anxious,Street enter charge side young value country clearly to public western range system someone but agree discuss determine process,Positive
2023-10-24,London,Excited,Central strategy road general firm television sing bed,Negative
2024-12-02,Paris,Anxious,Affect agency every up agency practice force course anything man,Neutral
2023-11-13,Dubai,Anxious,Into time put doctor behind yet hundred police left type use eye figure world white behind friend country,Negative
2024-11-17,Dubai,Happy,Carry president sister dinner along,Neutral
2025-03-01,Paris,Tired,Here imagine man cut production poor three suffer relate party surface bill prove agreement rest almost occur throughout,Negative
2023-10-05,Tokyo,Angry,Move poor think television fly we listen per about close ability,Positive
2024-03-10,Dubai,Anxious,Say win sell safe stuff find serious daughter best six,Positive
2023-12-02,London,Tired,Goal book everyone life move have some entire prove true,Positive
2024-02-19,Bangalore,Happy,Street policy want listen much,Positive
2024-05-28,Tokyo,Tired,Out speech one structure modern through section body common pm,Negative
2024-01-01,Paris,Excited,Listen say reflect whatever above call ball field,Neutral
2024-11-20,Bangalore,Happy,Financial decision us method firm join yet edge finish personal money protect bed party simple outside list,Negative
2024-03-09,London,Peaceful,Animal control return event wide check ever animal take machine difficult management impact student policy program eight,Negative
2024-04-22,Dubai,Excited,Price relate door his sister themselves good result prove safe clearly executive claimextra,Positive
2023-10-07,Paris,Happy,I behavior position building street half,Negative
2024-12-12,London,Happy,Who quality professor style tend team it far consumer care political job ten draw tv however,Positive
2024-01-20,London,Happy,It experience with happy agree,Positive
2024-06-19,Dubai,Excited,Per second science knowledge speech most recently he management,Positive
2024-03-19,Sydney,Angry,Suffer almost against admit treatment decide religious test risk easy mission,Positive
2024-09-20,Bangalore,Anxious,Play free popular speech soon unit deal,Positive
2024-03-12,Bangalore,Tired,Network way spring range analysis collegeextra,Neutral
2023-12-24,London,Tired,Success case expect add someone charge member someone across language meet pressure finish military air ready whole,Positive
2025-03-27,London,Angry,Network likely door accept property,Neutral
2023-10-01,Sydney,Peaceful,"Us respond stay paper air smile consumer ball whether simple resource often approach
support second analysis company reduce government need",Positive
2025-03-02,Tokyo,Excited,Idea sit out citizen well might fish subject spring dream far nice fine,Positive
2025-01-21,Paris,Happy,Board town market south either common western black safe project protect view,Positive
2024-02-01,London,Anxious,"Loss hear say about generation whatever way discussion
such prepare prevent after during law call exist throughout dog effort",Neutral
2023-11-17,New York,Anxious,Picture leave analysis a control color head interview realize property rather glass i herself,Neutral
2025-06-06,Tokyo,Anxious,Another someone individual quickly yeah fear minute small catch hope over store,Positive
2025-01-22,Paris,Happy,Decade poor spend other charge price,Negative
2025-04-11,Tokyo,Angry,Itself international whose develop because poor and couple nation turn bar so cut,Negative
2025-01-06,New York,Happy,"Hear them road arrive south choice analysis arm newspaper sit next later
democrat accept fill professional far cold upon history",Negative
2024-12-09,Dubai,Angry,Box performance mouth stuff eat week most husband travel perhaps allow water senior,Positive
2025-04-10,Tokyo,Tired,Notice ok mind write late them fast team player,Positive
2024-05-31,Paris,Peaceful,"Free success clear i tv message type consider near safe she upon executive exist sit get rather
star can wear attorney first compare try",Positive
2025-02-12,Bangalore,Excited,Agreement them white station democrat trouble coach company,Negative
2023-09-04,London,Peaceful,Really become analysis likely issue officer face head,Positive
2025-01-30,Sydney,Anxious,Nature east say note leave three really director certain defense difference whether another all,Positive
2024-12-06,Tokyo,Tired,Factor six their arm traditional data institution same focus event charge voteextra,Neutral
2025-05-31,London,Sad,Although create tell reveal growth know professor media learn whom cultural able small draw,Positive
2024-08-04,Sydney,Sad,Clear professional wear option improve structure opportunity step short together stop hour focusextra,Positive
2023-08-29,Bangalore,Peaceful,Kind pay relationship appear process hand sometimes key operation kind store office my white particularly,Positive
2024-12-30,Tokyo,Tired,"Lead open agent present through fear arm ever fast defense
rise drug fight task movement bring activity throughout bed artist region cause
there subject kind add risk",Positive
2025-07-10,New York,Sad,"Put treatment actually character human seem image sort wrong
yeah second light late agency once character effort quickly manage natural job book party matter ten glass",Positive
2024-04-14,Tokyo,Happy,Marriage stay training seat even window if science high sister politics check while appear stuff finish population,Positive
2024-08-19,London,Peaceful,College artist hand we citizen skin,Neutral
2025-06-18,Paris,Peaceful,Cell left former identify school assume bar,Neutral
2024-03-24,Tokyo,Excited,Head everyone because risk another customer lose stay avoid fall card may possible you his lead would eight evidence,Neutral
2023-09-05,Bangalore,Sad,Election vote tv list know floor best trouble size forward,Positive
2024-03-12,London,Tired,Policy above mr put final put general series nation institution point garden way example,Positive
2023-09-07,Dubai,Angry,Network away near where almost get itself financial both lawyer,Positive
2023-09-12,Bangalore,Angry,Second key poor explain key keep general up should,Negative
2023-11-03,New York,Sad,Style expert as them per century material,Neutral
2024-08-08,New York,Peaceful,"Writer state individual describe thing
firm character event family camera none offer magazine pressure actually",Negative
2024-08-16,Tokyo,Excited,Whom anything general him page again reason could build tell consumer,Positive
2025-06-28,Bangalore,Tired,Center hair pull age hair music staff scene ask again people thing another business quickly go,Positive
2024-04-24,Bangalore,Tired,Federal scene ago order modern cold develop goal scientist south condition answer professor,Negative
2024-10-11,London,Happy,Green popular per everybody billion paper better if media takeextra,Positive
2025-05-22,London,Tired,Town grow know simple necessary laugh behind place as gun even center decade whom several big do discuss room happen,Negative
2023-10-25,Dubai,Sad,"Debate decision budget good late group right enough soon
prevent of relationship sell
direction citizen than between name above sure line watch be economic travel pull",Positive
2025-03-26,New York,Sad,Card similar law for lay once available official money onto,Positive
2025-04-03,Dubai,Happy,Alone keep near scene mention argue seat southern democrat toward each,Positive
2025-03-27,Tokyo,Anxious,Pm effort season will medical camera visit however with government now,Neutral
2025-02-14,London,Tired,Rock direction situation i pm hope land him whetherextra,Neutral
2024-05-08,London,Peaceful,Instead thus goal budget bank spring hotel,Neutral
2024-06-01,Sydney,Anxious,Campaign mention design field born interview just major the team add reveal,Positive
2024-08-15,Sydney,Sad,Stage threat community thus hard each sometimes like floor law animal cell be level bar third,Negative
2023-10-03,Sydney,Anxious,Teach level past great sister travel listen girl likely social mouth whom every worry stock,Positive
2024-02-14,Dubai,Anxious,Campaign toward southern move,Neutral
2025-07-04,London,Peaceful,Ask nothing sort record notice south director cold over minute a clearly option war fast,Negative
2025-04-04,Bangalore,Anxious,Might when different itself far democrat material,Positive
2023-11-08,Paris,Angry,Treatment marriage room pull explain other feeling daughter billion party agree,Negative
2023-10-03,Paris,Peaceful,Face set section minute item individual usually happy seem employee subject,Positive
2024-05-24,New York,Anxious,Particular anyone property analysis when better line suddenly measure would,Positive
2024-01-30,London,Angry,Now person son run a law executive series public sound program approach voice ask firm less gas threat station outside improve explain ago indeed term agree allow,Positive
2024-12-19,Sydney,Angry,Place new step director or many reduce under,Positive
2023-11-10,Dubai,Excited,Serve life turn key rise dark raise,Negative
2025-02-06,Dubai,Excited,People trial build affect standard simple hit,Neutral
2024-11-24,Paris,Angry,Write never leader like seek final last senior but wide message conference cover other,Negative
2023-09-18,London,Excited,Really song language himself office responsibility camera possible media,Positive
2025-02-28,Paris,Anxious,"Agency actually must small research
blue all his notice per involve soon best six father say",Positive
2024-11-01,Tokyo,Peaceful,Position actually pay system professor floor success late most test control us born,Positive
2024-12-07,Bangalore,Tired,During energy there successful system,Positive
2024-02-21,Dubai,Peaceful,Value once low tend agree recognize stop still them purpose same director cover financial authority type next yeah wonder,Neutral
2025-05-01,New York,Excited,Tonight least hear way mother fact road apply professor pick,Negative
2024-06-11,Dubai,Peaceful,Nor him choose by make idea all sound traditional institution pass free democrat indeed camera me himself guy group especially check visit understand,Positive
2024-06-05,Tokyo,Happy,"Performance interest attention gun outside base century process though future
toward represent reason material hope ready paper draw various me nature",Negative
2023-07-24,Bangalore,Tired,"Prevent bag even seem among maybe civil operation lose
herself dark even garden its win enjoy range add mission evidence natural grow close case themselvesextra",Positive
2024-07-21,Dubai,Angry,"Go amount generation ready civil miss open citizen form many read go concern
reveal tell probably new girl thousand who might recently",Positive
2025-04-04,Sydney,Tired,Boy teacher action tree yourself people often process scene girl sense still body tough necessary rule,Negative
2024-04-11,Paris,Excited,Would woman southern plant dinner respond voice happy its task sport green dog avoid medical remember,Positive
2024-10-18,New York,Happy,"Avoid would once future ability whatever reduce begin health six must herself
two arm rich likely official ok defense change management enter sound record it enjoy soldier federal water",Positive
2023-11-16,Sydney,Angry,Much treatment recent option finally station mrs,Positive
2025-02-03,Paris,Sad,"Environment tonight room picture right
from smile artist condition leave foreign this require science research",Positive
2024-03-25,London,Tired,Represent beyond population call history in college example control leg,Neutral
2024-07-05,London,Tired,"Play into region risk commercial generation without daughter
eight star away his congress couple clear wonder nor eye idea summer single myself strong",Positive
2024-03-04,Sydney,Happy,"Power say ok machine church
recently institution energy central",Positive
2024-08-31,Bangalore,Angry,"Late kind control season exist face risk seek kind act national high book to
realize though authority ball building party fast",Positive
2023-09-25,New York,Happy,Seven either identify unit buy say anything future much three again readyextra,Positive
2025-04-08,New York,Peaceful,Sell others research yourself benefit surface space president money quite station be wall,Neutral
2025-02-04,Tokyo,Sad,Weight impact worry service machine study standard realize from note agency force personal change magazineextra,Neutral
2025-04-10,Dubai,Happy,Campaign investment key since perhaps education send huge technology fire stop,Positive
2024-03-21,Dubai,Sad,Director question important throw film family describe program,Positive
2025-06-08,Bangalore,Happy,Reach guy between behavior rate skill wife goal red no commercial current line member night open marriage why off fight series scientist ten,Neutral
2024-09-24,London,Happy,According fact truth marriage rather process many nor author party,Positive
2025-03-13,New York,Peaceful,"Difficult technology seat western positive home miss majority health music if
cover break important",Positive
2024-11-19,Sydney,Angry,Hand good around language find agent degree discussion to around start activity election really,Positive
2024-07-29,Dubai,Peaceful,Parent show fill draw control sure brother,Positive
2023-08-01,Tokyo,Sad,List travel pretty check expert argue series method bank finish respond blood today court give together dinner despite within though,Positive
2023-09-13,Tokyo,Peaceful,Section general interesting study nearly camera perform yes cause teach easy garden environmental activity place like support,Positive
2024-07-17,Bangalore,Sad,"Serious admit people suffer approach between explain true
practice piece school east break serious item itself might store leader cost population knowledge",Negative
2024-01-01,London,Excited,"Oil rich dog fill amount view also somebody
cell even government side",Positive
2025-06-07,Dubai,Peaceful,Pick black team step good prevent mother remain through site explain but door,Positive
2023-11-13,Dubai,Peaceful,Short attention tell box leader total life myself quite chance expert shoulder,Neutral
2024-11-02,Tokyo,Tired,Serious many serve trouble least leave student different,Negative
2024-09-26,Sydney,Angry,"Budget learn crime beat camera country under method six collection machine government join term house recently recently
message development age court",Neutral
2023-08-26,New York,Angry,Various court design garden sing thousand me allow environmental risk discover truth within also answer wall thus,Neutral
2025-03-07,Dubai,Sad,Movement accept behind determine rise without wall,Negative
2025-04-04,Tokyo,Tired,"Activity feel respond human commercial both attack look mother behind buy where
fish eye smile past cause pass provide order finish growth weight west front",Negative
2024-02-11,Bangalore,Angry,Ball discover religious region current economic player both then bring turn piece first project do may condition,Positive
2025-05-11,Tokyo,Angry,"Employee challenge happen quality safe his foreign much issue cultural size any fly play item
clearly particular onto finally play experience executive social perhaps she forward sister",Positive
2024-11-18,Paris,Excited,Base trouble score listen peace war any yourself break nice usually worker,Negative
2024-03-03,New York,Tired,Friend local evening pattern thank throw do that fall free laugh increase,Positive
2023-11-26,London,Tired,Total political and mouth require it each sense but,Neutral
2024-02-18,Tokyo,Excited,"Occur fear alone decade give whether big off
half week election agency director activity contain image",Negative
2025-07-11,London,Anxious,There popular five system travel fill machine animal senior process late there add entire,Positive
2024-02-20,Sydney,Angry,As left like toward off just best story various type bank her measure person a contain part maintain view,Positive
2023-08-05,Sydney,Excited,Son free want member question class college travel father leader some,Positive
2024-12-14,Paris,Angry,Strategy still piece year in brother brother of kid seem teach inside media hour house,Neutral
2023-08-24,New York,Angry,"Ever understand edge student meeting own nearly education red adult he employee let career
point feeling become free lose performance whole note seek ready world every age",Positive
2024-03-18,Paris,Peaceful,Different its also since south wrong own,Positive
2025-03-20,London,Sad,Financial force total base,Negative
2024-08-18,Sydney,Happy,Company race require dark floor without,Negative
2025-05-18,London,Excited,Certain source structure performance meeting leave despite head him share reflect,Positive
2025-01-20,Tokyo,Tired,Discuss identify religious consider method first night woman community,Positive
2024-05-12,New York,Excited,Could use of federal forget leg commercial answer by value child example politics act,Neutral
2025-03-11,London,Tired,Senior town stage remember civil reason voice young theory meeting meeting trouble,Negative
2024-07-16,Paris,Excited,"Project service finally rather majority military evidence car sing recently
beat fire course adult instead set interest level fact",Neutral
2024-08-17,Paris,Anxious,Reflect herself share surface perform important push test work wife less,Positive
2024-03-27,London,Anxious,"Purpose back ago story radio both speak billion involve performance why material form night economy
difficult also off carry crime court wonder sometimes short yet trial",Negative
2024-11-06,London,Excited,Identify the four issue candidate thus majority big left who trade,Neutral
2025-06-28,Dubai,Peaceful,"Security bank pretty kid you one mr size down
suddenly however task eat difference enter sort apply stop party air",Positive
2025-01-07,Tokyo,Anxious,"With yard my contain education read society approach human
indicate course suffer role interview method true moment country over to result",Positive
2024-08-10,Tokyo,Happy,Candidate traditional include several training than community both which machine everything office perform every hundred win be,Positive
2025-01-01,Dubai,Peaceful,Increase claim national enter continue meet alone vote anyone modern system suggest miss,Positive
2024-07-03,Paris,Angry,Main if mind me painting modern beyond spring marriage green impact hand owner,Positive
2025-03-08,London,Excited,Time well single thus address maybe success push that relationship benefit answer method growth song message public,Positive
2024-07-25,Bangalore,Peaceful,Run like require debate sometimes whose family,Neutral
2024-02-09,Sydney,Peaceful,Collection citizen professional same plan minute at clear easy reality play but speech conference research part so price,Positive
2024-09-20,Dubai,Anxious,Gun return its approach news section by democrat stuff investment since pattern seat amount large,Positive
2024-10-17,Dubai,Tired,"Responsibility movement onto room sure project
together treat until claim near spring wife investment as",Positive
2023-08-29,Sydney,Happy,"Simply walk cup kind worry
produce city from especially article lay concern standard about conference whom see song character past",Positive
