date,location,mood,memory,sentiment
2024-12-23,Dubai,Peaceful,"Throughout another include pattern current provide finally police member officer cultural by player gun minute
can try serious interview year lose landextra",Negative
2025-03-01,Tokyo,Angry,Tend hair force when course street whole ahead yourself cup concern,Positive
2025-04-12,Dubai,Anxious,Between back over artist win question message growth this mention capital produce activity,Positive
2025-02-17,Bangalore,Excited,Notice general because unit,Positive
2024-04-26,Tokyo,Sad,Me production specific article view box attorney put prove art her star cold impact feeling describe position purpose,Negative
2024-07-10,Dubai,Excited,Deal nearly lead middle official although skill push job administration pass,Positive
2023-09-13,Paris,Anxious,"Student result child however begin involve national far arrive worker during evening
thus second stay executive sell later check other who west",Negative
2024-06-23,Dubai,Tired,Rule country there like job role order,Neutral
2024-10-16,Tokyo,Sad,Opportunity push stuff light under speech make buy blood writer agent likely push draw join evidence plant,Positive
2023-10-14,Tokyo,Angry,Treat beyond without group environmental mission phone writer identify join order,Neutral
2025-02-28,London,Anxious,"Away arrive might exist popular evidence resource memory edge statement check
agree involve now energy look as tell",Positive
2025-05-29,Sydney,Anxious,Reach evening hit my threat hear mother usually reduce eat if work,Negative
2025-02-01,Paris,Anxious,Nice enjoy fly where red seven line where,Positive
2024-07-23,New York,Excited,Set young it even development upon third pull democrat rate,Positive
2025-01-25,Paris,Peaceful,"Return real and nearly white then carry number
particular month congress heavy kid southern respond police smile bed six necessary coach clear",Positive
2024-12-20,Dubai,Happy,"Study all rule treatment all if in build degree whatever outside song fast
get sense area plan culture discussion data result hundred most short if each hundred measureextra",Positive
2024-10-17,Paris,Excited,Man while surface participant ten floor artist them citizen business do base reach size,Negative
2024-02-13,Tokyo,Excited,Important wrong from cover someone mother,Negative
2025-07-07,Paris,Tired,Later argue including above give late approach improve save amount rate,Negative
2025-04-14,Dubai,Excited,Natural shake sound response hit current civil,Positive
2024-11-30,Bangalore,Happy,Guy five step money center ok form become notice seven accept painting,Positive
2025-01-29,Paris,Happy,But call grow subject get each dinner seven bill four strong now picture truth different drug time while,Positive
2025-04-23,New York,Happy,Concern everything keep cause field almost doctor prepare because federal capital save major begin whose inside this property rock must,Positive
2024-04-08,Sydney,Sad,Represent sell culture available they throughout evidence organization establish contain democrat,Positive
2024-05-31,Sydney,Sad,Team traditional set determine success rich clearly pass analysis nation listen,Positive
2024-12-19,New York,Peaceful,"Lot traditional although mission exist career until feel six tree born arm responsibility scene
responsibility fund ever alone player idea nice dog service bar building",Positive
2025-07-08,Paris,Peaceful,Another if ever consumer could accept,Neutral
2024-11-21,New York,Happy,"Pass back sound specific reflect without wall office them fall nation arrive
office probably show or see public benefit happy lot eight certainly scene",Positive
2025-03-09,Dubai,Angry,His finish seem memory mention college do result first step out difference,Positive
2023-08-31,London,Peaceful,Good month whole explain station help guess country month put right,Positive
2023-09-22,London,Excited,Receive place friend tend according money person language everyone media mr,Neutral
2024-08-15,New York,Excited,Should protect couple use establish my ahead,Neutral
2024-01-03,Dubai,Peaceful,Indeed each staff open dark,Negative
2023-12-15,Paris,Happy,"But i though strategy method out especially question pick this your deal million
trade statement brother easy alone trial show course thus college decide",Positive
2024-01-25,Sydney,Happy,Long southern ready reality group friend season national kind activity smile indeed still whole,Positive
2024-09-26,Tokyo,Anxious,Ahead your recent need visit prepare cultural design discuss detail color because position,Positive
2023-12-31,Bangalore,Excited,Information perhaps foot your little section now prepare experience leave miss message administration fine year air similar history indeed career worry mission town travel author population,Positive
2024-05-03,Tokyo,Anxious,Federal environmental not of do picture beat surface structure home job current charge performance a stock sell think,Neutral
2023-08-26,London,Sad,International central year smile none,Positive
2024-04-14,London,Anxious,Standard parent yes citizen art guy focus call much small,Negative
2024-05-27,London,Angry,Meeting marriage cell general executive mission can bag city chair difficult shake expect,Negative
2023-09-30,Dubai,Tired,Their mr coach end usually material although possible always yourself program especially dream cell,Negative
2023-08-11,London,Tired,Involve old there blood one condition try now lead,Positive
2025-07-09,Bangalore,Angry,Of forget history sit continue enter audience describe way arm level never agree woman,Neutral
2024-01-25,Tokyo,Tired,Race coach difference firm very may family today,Neutral
2024-12-07,New York,Excited,Around up say daughter per those election safe,Positive
2024-07-08,Tokyo,Happy,Such dark white remember this song ok scene rule go,Positive
2024-08-04,Paris,Peaceful,Might remain commercial worry election role arm try stay sing machine expert look look,Neutral
2023-08-25,Sydney,Anxious,Player unit toward heart mean raise economy foot at star gun during against rich should case market,Positive
2025-01-01,New York,Peaceful,Large current skill election dinner late impact institution even career speak financial inside,Negative
2024-04-20,Sydney,Sad,Family some save service occur behind note institution finish business situation measure scene leg occur whatever else,Negative
2024-05-17,Paris,Happy,Decide tax interesting kid late month key say property agent then run seven maybe price author moment,Positive
2024-11-01,Paris,Peaceful,"Civil easy air second near entire act decade for quality if itself live water offer three purpose
safe behavior able successful hit hard special father language arrive turn address",Positive
2024-04-19,Bangalore,Sad,Address staff else describe between season sea region or new,Positive
2024-02-18,London,Excited,Dog lay agree security raise yourself call song allow result,Neutral
2024-04-23,London,Sad,Pull subject issue nice laugh world believe gun when while fatherextra,Positive
2025-05-19,New York,Anxious,"Tax stage scientist
specific ever air though",Neutral
2025-01-19,Paris,Anxious,Actually believe speak particular receive act help each anyone leg where south sea center community avoid offer,Positive
2024-10-23,Paris,Angry,Paper able face maintain lot cut,Positive
2025-05-23,Tokyo,Angry,Board drug final early sea nearly only,Positive
2024-12-09,London,Sad,Environment size what spend hour or blood image perhaps finish,Neutral
2024-04-22,Paris,Sad,Employee agree effort approach form maybe amount,Neutral
2024-01-29,London,Happy,Nation wall bad trial order give her employee good data middle both major almost medical teacher trade society whom,Positive
2024-08-19,Paris,Excited,Language cup along company base ground anyone range local then industry he brother front machine quite family for unit,Negative
2024-09-29,Tokyo,Angry,Fish often control weight learn positive response rise beat significant hot style,Positive
2024-02-17,New York,Angry,Care blood else issue,Neutral
2025-05-11,Sydney,Anxious,Challenge price pass create room mean but new word,Negative
2024-05-08,Tokyo,Tired,Skill environmental word affect cup area message protect section,Neutral
2025-01-08,London,Sad,Mention word institution its during pay reflect anyone value new part word she ahead tree,Positive
2023-11-24,London,Happy,Such argue cup however shoulder position,Neutral
2025-04-26,London,Angry,"Owner true final why ability could report every individual drop
military nature consumer financial small ability",Negative
2024-12-22,Tokyo,Sad,"Main simply near meeting whom really
music how father subject as cost crime boy ask",Positive
2023-12-07,Bangalore,Peaceful,Gas picture rich example listen success study organization development myself physical use campaign us soldier,Positive
2024-02-29,Sydney,Tired,Story force military tend throw blue value,Negative
2024-01-31,London,Peaceful,"Hot shoulder change plant measure police television special campaign remain doctor lot
billion week prepare help fall person movement bank different",Positive
2023-11-24,Tokyo,Tired,Certain style answer we list door kid soon customer feel bank white after wait note,Positive
2025-05-21,Dubai,Tired,"Hundred body until thing decade country place modern remain one time
wife way who policy view can same mrs leg bank man",Positive
2023-12-01,Sydney,Angry,Bit it focus thing analysis animal should assume health environment able light grow especially teacher four,Positive
2024-02-12,London,Anxious,Maybe force situation low,Neutral
2025-06-16,Bangalore,Anxious,"World challenge time world way technology kid gun
organization thank fish sister know show contain raise song",Neutral
2024-07-21,London,Anxious,Exactly high community television student respond senior ready southern third ahead else share wish person less stand political ground attention particular institution store throw couple beyondextra,Positive
2024-02-24,Dubai,Sad,American deal home every team level sister author air white personal through foreign able letter future particularly,Positive
2024-11-18,Dubai,Tired,"Front book song after also behind vote stop south deal win fast
front morning pretty anyone fear physical person student walk",Positive
2023-11-24,Paris,Anxious,Spend very society easy simply four organization service consumer performance person,Positive
2025-04-10,Paris,Peaceful,Win enough board fact a particularly left enough son shoulder give child,Positive
2024-08-30,Paris,Tired,Compare begin live authority their activity sound commercial end development,Positive
2025-07-06,New York,Tired,Capital south fire glass these onto commercial information expert wide science court be weightextra,Negative
2024-06-06,London,Sad,Late support environmental poor interview institution research across affect grow off on site break security,Negative
2024-10-15,Tokyo,Angry,Wait professional western boy decide same both remain customer history ahead tough list top team employee pattern,Positive
2023-10-11,Bangalore,Tired,Exist follow current product father seat law peace news yet reduce gun smileextra,Neutral
2024-02-14,Paris,Tired,Try unit tv attack clear also involve stay month become friend reflect us blood usually begin manager,Negative
2025-02-06,Bangalore,Happy,Strong too building girl their federal act center join article senior,Positive
2023-12-23,Paris,Angry,Recently fight arm ball discover,Neutral
2025-04-18,Sydney,Peaceful,Hospital finally kind forward during send upon child plan plant,Positive
2024-02-06,London,Angry,Little computer thought open woman up,Negative
2025-06-01,Bangalore,Excited,"Apply language tax yet standard decision ok ten
treatment effort happy address each write yet become military audience wide item value lead area",Positive
2024-03-18,Sydney,Angry,Report wear size remain debate idea cold raise how low pressure window skill,Negative
2024-01-25,London,Sad,Care pressure discuss,Neutral
2024-03-24,Bangalore,Tired,Series card car day spend yourself fund image career skin,Neutral
2025-01-02,New York,Tired,With message pretty read full property discussion more choose couple will,Positive
2025-07-06,New York,Tired,"Woman when bad recognize
here may present food house plan",Negative
2023-07-16,Paris,Anxious,Style light federal mean detail they research present beyond issue than,Positive
2025-03-26,London,Peaceful,Political strong mean series themselves soldier page,Positive
2025-02-25,Tokyo,Anxious,News face hospital computer measure identify later deal audience raise station kitchen modern reach,Positive
2024-05-25,Paris,Happy,But exist close down,Negative
2024-12-17,Paris,Anxious,Baby particular operation anything us mission force relate then inside election goal interview toughextra,Positive
2024-05-01,New York,Excited,"Cover both tv hand action law attorney student mr first society property
today physical difference real care or crime glass money",Positive
2024-12-02,Sydney,Anxious,First example north wonder sound executive police international firm project,Positive
2024-08-06,London,Angry,Fast price budget response toward tend act occur big them professional,Positive
2024-01-03,Paris,Tired,Most name deal however help section check,Positive
2024-10-29,Paris,Sad,Ahead tv along war serious born section success buy maintain page,Negative
2025-06-09,Bangalore,Happy,About class guess be laugh avoid to truth hand somebody study federal painting class science,Positive
2024-11-30,Sydney,Tired,Difference organization join building effort yes,Neutral
2023-10-09,Tokyo,Sad,Yard couple way message may animal,Neutral
2023-10-27,Bangalore,Excited,It others hard these research expert seek fine power reduce example,Positive
2023-12-22,Dubai,Sad,Project technology billion fire goal just site town identify,Neutral
2025-03-30,London,Peaceful,Realize tonight six will decade right country institution clear right design people treatment figure degree,Positive
2025-02-13,Tokyo,Tired,Reach enjoy lose spend try than start nation,Positive
2024-06-22,Tokyo,Angry,Water picture skin worker figure above early hand majority than before culture,Positive
2024-06-07,Bangalore,Peaceful,Foot onto amount can late street commercial interesting water soldier cost likely again certainly,Positive
2024-01-19,London,Sad,Decade type organization campaign,Neutral
2024-10-25,New York,Happy,Ask represent story cultural onto your her rather quickly responsibility number son allow practice various floor,Positive
2025-02-18,Sydney,Angry,Sport operation eight lead person money send board way consider chair skill under stand may,Neutral
2024-10-31,Bangalore,Peaceful,International produce growth at each standard consider piece live well care fly focus,Positive
2024-04-25,Dubai,Happy,Also thought move site time growth never campaign marriage agree left next check,Neutral
2024-01-15,New York,Anxious,Answer role social with research administration whatever grow,Positive
2023-12-04,Bangalore,Sad,"Mission wait half hair long
possible car stock candidate former",Negative
2024-10-24,Tokyo,Angry,If store nature each message poor somebodyextra,Negative
2025-02-13,Dubai,Peaceful,Attorney beyond mouth many,Positive
2025-07-06,Sydney,Anxious,"Coach explain energy act able industry sell when great catch physical
suggest happy marriage southern degree tough high try control",Positive
2024-02-15,New York,Angry,Side green add stay mr especially laugh from bad everything establish,Negative
2025-03-18,New York,Excited,Available authority single community really direction in need real ever meeting pattern realize talk politics myself,Positive
2024-02-26,Tokyo,Peaceful,Pretty speak stand window according account bit wind capital can both yet,Positive
2023-07-20,Bangalore,Excited,It tough research keep possible nice right mission design away,Positive
2023-11-20,Sydney,Tired,Many rich product activity dark fund real decade,Positive
2024-10-04,New York,Sad,Also method born decade,Neutral
2024-09-15,Bangalore,Excited,Public stay surface test development rest production probably store any social bag behind such believe,Negative
2024-03-12,Bangalore,Excited,Pass green like store tv report site level summer while inside rise tough human should whom,Negative
2024-02-12,Dubai,Happy,Difficult wrong source say college test accept party note action,Negative
2023-09-10,New York,Tired,Beat investment certainly marriage example local grow to back street project,Positive
2023-11-16,New York,Angry,Reach far our second organization five still shoulder democrat kind production leave series general,Positive
2023-09-03,London,Excited,Name official indeed various a war technology commercial for management program couple herself few here range clear economic marriage,Positive
2024-01-30,Sydney,Excited,Bed ok meeting give politics benefit officer bit author,Positive
2024-10-11,Bangalore,Happy,Radio chance in turn bit employee leader,Neutral
2024-02-22,New York,Peaceful,Most answer bit suggest pressure style save with room,Positive
2024-04-01,Dubai,Anxious,Key modern pass themselves standard war,Positive
2024-11-15,London,Peaceful,Themselves read movie likely president west ten action similar reason order stand,Positive
2025-06-10,New York,Anxious,"Act piece total north response increase born less get discuss
manage career reach current put pass reason line score pull world what no mission through everybody",Negative
2023-09-05,Tokyo,Excited,Station respond court behind church short job evening expert might animal series them,Negative
2023-12-10,Paris,Happy,Rise fact several since woman success safe,Positive
2025-06-06,Sydney,Peaceful,Task recently possible international remain best day,Positive
2024-10-29,Paris,Happy,Serve expect page fire medical even another economy article out although company deep,Neutral
2024-04-01,Tokyo,Peaceful,Involve finish everybody thank tax early heavy,Negative
2024-12-03,London,Tired,Clear mrs top against live scene road move rock bill paper little service oil,Positive
2025-02-03,Tokyo,Anxious,Yes spring deep fill bad say east once challenge,Negative
2025-04-01,Paris,Sad,Return up read adult certain bar guy far do design to mother while,Positive
2024-05-08,Dubai,Tired,Discussion group person common table congress lose watch season nation arrive point often,Negative
2023-11-06,Bangalore,Tired,Allow minute fill beyond year crime certain agent season me tend action,Positive
2025-01-31,Sydney,Angry,Might campaign keep budget might relationship next approach politics resource example population amount office surface material important each,Positive
2023-07-30,Paris,Sad,Center source season final everyone concern very every federal,Positive
2024-05-20,New York,Sad,"Continue picture college foot remember serve under guess game no raise
lot through system relate trade pick charge keep participant meet",Negative
2024-05-21,Paris,Happy,Couple goal meet discuss follow,Neutral
2025-07-10,London,Anxious,Who office maybe read beautiful scientist measure discover course,Positive
2024-02-18,London,Tired,How keep against part group board laugh party director reach only,Positive
2025-06-13,Dubai,Peaceful,Senior collection particular president leg result police than campaign leg hair,Positive
2023-08-01,Bangalore,Anxious,Approach key despite every move reflect tv summer organization around trip oil until billion,Neutral
2023-11-11,New York,Peaceful,Deal from economic but nothing floor those indeed most parent world growth threat choose win project land,Positive
2024-12-21,London,Tired,Game worry trial organization right field,Negative
2024-07-10,London,Angry,Compare kitchen action level blue include yeah,Positive
2024-06-24,London,Happy,Guess our manager look long forget born moment level both difficult put,Negative
2023-12-24,Paris,Angry,"Bit want section season trade mention west magazine author bag finish onto watch mission tree such child its
month minute keep contain region current rather",Neutral
2025-05-09,London,Anxious,Cup discover somebody political drop answer three particularly amount quickly along free room,Positive
2025-03-20,London,Sad,"Operation trial finish by we long else figure follow indicate floor play
form stop environment newspaper method some letter plant",Negative
2024-03-17,Sydney,Excited,Push wait town rather step wish relate bad kind career,Negative
2024-04-23,London,Peaceful,Rather represent image her within according identify picture sure left surface back i who model,Positive
2023-12-05,Bangalore,Sad,"Hair down agency ask member mrs authority take improve sister forget
idea particular reflect owner speech south purpose",Positive
2024-11-27,Paris,Anxious,Picture natural about trip response pressure bed democratic act action administration machine,Positive
2024-05-04,Dubai,Anxious,"Ever parent street agent born character attorney water popular top wide voice especially girl
thank fall street him should event and box again gas you economic seek food american",Positive
2024-08-15,London,Angry,Foreign his message discover safe across perhaps between before color heavy ever create,Positive
2024-10-14,Tokyo,Peaceful,Growth yet former question kind visit poor we majority product official should magazine however save oil film who team currentextra,Positive
2025-07-10,London,Tired,Meeting beat much together under interest,Positive
2025-01-06,Sydney,Anxious,Long travel stock fill west reflect road road buy just yeah war make arm,Negative
2024-07-17,Sydney,Anxious,"Might various here figure get third interesting build material
sometimes or charge left institution red away spring choice watch already especially should tripextra",Positive
2023-11-01,London,Excited,Station direction support that enter many,Positive
2024-04-08,Tokyo,Anxious,Thousand trouble sense popular ability water heart seem,Positive
2024-11-27,Tokyo,Peaceful,Read one job maybe stage care feel also national great even now authority ok former assume line water,Positive
2024-02-08,Paris,Anxious,"Let religious game take second task actually feel first save appear buy radio list else huge husband out government
development front animal head knowledge finally mother behavior",Positive
2024-06-12,Paris,Happy,"Increase firm teacher safe wind sure possible nothing write move star challenge player answer
fish common save nature between guy painting anyone expert activity position",Positive
2024-09-18,London,Happy,Worry fine day use stay once price know direction case,Positive
2024-07-25,Tokyo,Tired,Thank day exist occur physical relationship television old performance over throw rate lay very around,Positive
2024-09-20,New York,Tired,Two amount own never receive tv lay else never,Positive
2024-08-10,Dubai,Angry,View mr everybody,Neutral
2023-10-05,New York,Angry,Begin oil visit public general laugh morning story member house drop man site side sit own discussion tend enjoy add rich population,Positive
2024-08-03,Paris,Angry,Mission car nature type along city debate recently partner far thing tend wish product drive man deal whole me movement,Positive
2025-02-23,Paris,Excited,Coach seem coach chair when arrive radio probably be describe make two its political send stay bad industry,Negative
2025-05-02,Tokyo,Peaceful,Military old sort he leave music miss base space single past real present inside a,Negative
2023-11-07,Tokyo,Tired,Him father successful sea boy serve carry later and try carry activity difference this skill american dinner,Positive
2024-12-17,Paris,Peaceful,Your special back specific our grow generation blood range,Positive
2024-05-23,New York,Happy,Start prove country position language daughter work him feeling threat,Neutral
2024-11-11,New York,Peaceful,Language give treatment chance rock market heavy language authority,Negative
2024-02-10,Bangalore,Sad,Effort phone necessary how,Neutral
2023-12-29,Sydney,Anxious,Son return nothing remain thus possible,Neutral
2024-12-16,Tokyo,Sad,Cold reach organization both economic hot ever,Negative
2024-05-01,Tokyo,Excited,Game actually work reality how appear ok attack wonder scene,Positive
2024-05-29,Dubai,Sad,Guy because piece company style brother guess as although if our,Neutral
2024-06-12,Tokyo,Happy,Prove behind mind among sell particular accept listen cause list,Negative
2025-05-01,Sydney,Sad,Again board majority message seek style center television beyond rather political,Negative
2025-04-24,Paris,Peaceful,Suddenly everyone black show other store plan exist federal move shake ten recently,Negative
2024-03-21,Sydney,Angry,Community everybody store suggest leg second,Neutral
2023-09-28,Paris,Angry,Development medical its consider trouble will force,Negative
2025-02-22,Dubai,Tired,Open yard man at west onto understand list most nice dog key easy too think bill no policy,Positive
2024-01-22,London,Anxious,Mother drug investment child generation hear,Neutral
2025-04-17,London,Sad,Notice within every final state,Neutral
2023-08-20,Paris,Peaceful,In either cultural age pick society administration whole popular thought carry apply break part step name near stock daughter next challenge article night environmental,Positive
2023-07-21,New York,Excited,Close resource red stop rest to vote garden recent art analysis avoid might,Neutral
2024-12-27,Paris,Angry,Whom plant ok great son always,Positive
2023-10-15,Paris,Happy,Others management fall party major democratic method together machine pick treatment be,Positive
2024-01-04,Paris,Angry,Major skin thank window task discussion whole beautiful help important share interview personal improve instead trip rule,Positive
2024-07-07,New York,Tired,Treat throw miss growth stuff,Neutral
2024-08-27,Paris,Anxious,Suffer surface poor adult thing accept hair news analysis site bag,Negative
2024-08-13,Tokyo,Excited,"Buy else often view respond hope know time dark tend product let apply science friend body executive west
east catch rather chair owner field some",Negative
2025-05-04,Sydney,Anxious,"Week learn finally within too all spring provide view congress
true thousand before future pattern student business difference to",Positive
