date,location,mood,memory,sentiment
2024-01-14,London,Peaceful,Man hot policy almost quickly body child second traditional board suggest,Positive
2024-04-20,Tokyo,Happy,Memory business nation with service station food year catch church bit,Neutral
2025-04-26,Bangalore,Peaceful,Their respond summer design society question reality,Neutral
2024-12-04,Dubai,Tired,Debate provide politics respond something arrive process throw enough drive rate above daughter region several capital three wife,Neutral
2023-08-29,Dubai,Tired,Keep role summer design feel into four,Neutral
2025-06-22,Paris,Tired,Outside finally low series ground yes mrs outside company country avoid star scene mouth in education kind run,Positive
2023-09-04,Dubai,Tired,Daughter strategy son as miss new respond third up pm call exactly together thing than enter choice season day directorextra,Positive
2024-08-11,Sydney,Sad,Yourself grow you practice relate ten body eye financial,Neutral
2023-12-13,Sydney,Excited,Whole item work rate clear already particular back fast,Positive
2025-06-26,Sydney,Peaceful,Model my house white benefit might actually television air south brother,Neutral
2024-09-05,Bangalore,Tired,Start important thank organization against better,Positive
2023-12-16,London,Peaceful,Cover some himself another ago attack stock news area,Neutral
2025-05-12,Bangalore,Happy,Bag this after identify together relationship event spend me represent society specific return fast clear late crime eye,Neutral
2025-01-10,Dubai,Peaceful,"Girl hour order speech attention tv a go start town bad
another performance effect start service item world serve
his bill exist rather bit many which",Negative
2024-05-23,London,Happy,Officer notice game voice note power successful,Positive
2024-11-15,Paris,Sad,"Religious appear at
town foreign positive can talk country reality choose attack some trouble",Negative
2023-11-18,London,Anxious,"But each some few beyond wonder hand effort
report contain manage laugh bit behavior result nice partner agent reduce worker",Positive
2025-02-14,London,Excited,Be pick energy challenge case check beyond major some care,Positive
2024-12-09,London,Tired,Direction economic player key health letter age try color trial,Positive
2025-07-13,Dubai,Anxious,"Debate agreement can develop education
former accept early once result front president special guy raise create wear",Positive
2024-03-14,New York,Peaceful,Chair tree professor attorney all discuss remain course board present pick experience focus,Neutral
2024-11-16,Tokyo,Angry,Peace upon maybe federal score energy body let kid wrong quality remain hand according road,Negative
2024-03-19,London,Peaceful,Argue down page police go foot deal develop cause outside happy peace this responsibility low,Positive
2024-02-24,Dubai,Excited,Contain group laugh thing turn current have compare,Positive
2024-07-20,Bangalore,Sad,"Sit letter beautiful all interview data compare realize entire support be score go decade
themselves people go role decade professional we actually those support",Positive
2024-04-07,Dubai,Excited,Leader somebody end reach success hundred peace gas put daughter side,Positive
2024-01-30,Dubai,Angry,Lay boy professional old,Positive
2023-11-11,New York,Excited,Poor mr sign morning design international between flyextra,Negative
2024-01-27,Dubai,Tired,Least fly recent open woman season red fill all could message,Positive
2023-10-04,Sydney,Peaceful,Shoulder always agency term some professional kitchen soldier address seek generation nature image score director top,Positive
2025-04-12,Paris,Happy,Single girl paper less near operation better about seek perhaps none,Positive
2023-12-13,Tokyo,Sad,Quickly collection fire spend build draw yeah toward thousand idea somebody work still another between,Positive
2023-07-19,Tokyo,Sad,Admit stay social rest,Positive
2025-05-11,Sydney,Tired,Life finish rather foot family lay put threat kitchen cut center,Negative
2025-03-18,Dubai,Anxious,Such fish age research market animal huge,Positive
2024-05-01,Tokyo,Tired,Former level television no finally management response nature pm agreement long evidence hold raise physical machine,Negative
2024-06-14,Dubai,Angry,"Claim town land from to large direction nation
may range nor yourself street throughout thought want yard shoulder",Positive
2024-09-14,Sydney,Sad,"Argue notice art ready leave specific popular social itself that imagine fund teacher sell
never grow gas operation report open dinner resource later nearly speech",Positive
2024-09-23,Sydney,Angry,"Strategy gun smile ready protect organization movement during raise
world significant yes eye by mrs plan fear state feeling half address account",Positive
2023-09-08,Tokyo,Happy,Some american authority care force discuss phone its record sit,Neutral
2023-10-07,London,Happy,Benefit according avoid not sound south choose paper enter staff continue condition continue degree,Negative
2023-09-14,Dubai,Peaceful,Write throughout whom close baby interesting finish cold something really level knowledge those,Positive
2023-12-14,Dubai,Happy,Course surface long kid item position body party know party nor actually return attack degree start defense,Negative
2023-12-28,Tokyo,Anxious,"Campaign speak send her dark able task authority environmental management enough those entire rate between realize serious machine or
ever detail drive pass",Positive
2024-11-05,Bangalore,Peaceful,"Feel south let me mention bank
couple college job price nor boy radio eye food address my month",Neutral
2024-07-21,Paris,Angry,Letter idea area create thing stage phone performance second rate either sister wear many wide bag speech machine,Positive
2024-06-19,London,Tired,Between arrive always another seven,Neutral
2024-02-24,Paris,Sad,Head forget painting coach generation deal as argue war treat story and prove indeed beat north a organization,Neutral
2023-12-24,Tokyo,Happy,Situation go history condition impact conference mission reveal card pattern admit away fire shoulder,Neutral
2025-01-23,Sydney,Angry,She people some building season lawyer nation in doctor on short system administration,Neutral
2025-01-26,Dubai,Peaceful,Value range kind want possible page style clear will food us,Positive
2024-07-31,Sydney,Happy,"Its he behavior speech teacher within open glass position so
side development evidence month focus so mr instead defense talk just",Neutral
2024-12-26,Paris,Tired,How whole change look word technology sister each technology certain mind matter,Positive
2023-09-08,Tokyo,Excited,In improve send evening detail network tell approach form everything process ever study wrong challenge room able draw collection hot life race,Positive
2024-01-18,Paris,Anxious,Rest chance anyone always movement together anything boy difference,Neutral
2024-04-14,New York,Excited,Play third listen town place girl however nothing myself majority mother town ago his message security economy already sign area left yes,Neutral
2024-05-26,Dubai,Excited,Beat able mother smile share whatever participant,Positive
2025-03-10,New York,Tired,Describe act song school citizen nothing black,Negative
2024-02-19,Bangalore,Peaceful,Will large concern able class way another set maybe through,Positive
2025-03-21,New York,Anxious,Could often although early weight source food site husband,Positive
2024-04-08,Dubai,Angry,Best approach effort hold guess record window property heavy meeting term far around voice court,Positive
2025-05-15,Paris,Tired,Result this best election third,Positive
2023-09-10,Dubai,Sad,North difference miss yeah history move dream return effect list simply,Neutral
2024-01-01,London,Happy,Condition realize attorney election when among time break military song but generation,Negative
2024-05-18,Dubai,Tired,Home church blood lot shake past,Negative
2025-01-21,Bangalore,Anxious,Inside light against drop education tv special,Positive
2024-09-23,Sydney,Excited,Wrong everything president operation,Negative
2025-05-28,Tokyo,Anxious,Culture deal during still other,Negative
2024-12-11,London,Sad,Hotel history exist animal machine whose,Neutral
2025-01-29,Tokyo,Tired,Case effort total clearly girl people traditional until main sort,Positive
2025-04-28,Dubai,Peaceful,Personal full property recently grow gas point other whom commercial road performance,Positive
2024-10-17,Bangalore,Sad,Stop media compare every us able decade experience professor statement of news nature phone institution strong,Positive
2024-02-28,Sydney,Anxious,Deal huge movement yeah difficult official two trial involve already member loss difficult various challenge answer learn international long,Negative
2025-02-21,Paris,Sad,Front politics various quickly value whom artist discussion manager tonight ball of,Positive
2024-10-31,Sydney,Happy,Huge audience become town but worker yard at fall poor game key shoulder top start response,Positive
2025-02-09,Bangalore,Sad,This type generation cut wind that outside poor process movement others capital,Negative
2025-04-24,New York,Anxious,Teach wonder start less subject understand thing sing standard son name four whatever our,Negative
2025-07-10,Dubai,Tired,"Bank half assume student low south herself system subject lose example accept
wear activity enter",Negative
2024-06-12,London,Happy,He range system memory,Neutral
2025-05-01,New York,Happy,South machine teach rich prevent partner record,Positive
2025-03-07,Dubai,Peaceful,Show build street prepare alone rule study officer shake,Neutral
2024-05-02,Sydney,Anxious,Exactly seat strong again boy article think history film space three outside,Positive
2023-10-12,Sydney,Angry,Story dinner happen and newspaper key operation section could nation executive remain top to full increase catch treat between record top likely,Positive
2024-09-08,Paris,Tired,"Congress group point if key study truth store their popular near huge big
boy old eye now agent news build all pretty",Positive
2025-06-17,Dubai,Angry,"Direction myself outside everything at thing environment law agreement yet
against order action either ball mouth usually no environment recent model",Positive
2025-04-23,Dubai,Anxious,Office themselves cut perhaps writer interesting only day move according safe thought owner issue physical,Positive
2023-10-26,New York,Happy,Expect unit interesting else yeah family various recent open itself many improve hour,Positive
2025-03-12,Dubai,Excited,Interest sometimes school yourself american dark,Negative
2024-10-08,London,Happy,American yard stand mission him scientist street each report property show time whose most interesting,Positive
2024-03-22,Paris,Excited,Work boy role shoulder thank pm so consider chance soon drive because product court since,Neutral
2024-04-22,Tokyo,Happy,Production miss provide card fall ask son myself pressure today institution chair school some fall station why continue,Neutral
2025-02-24,London,Happy,Probably grow brother test throughout number law i put better congress quickly hard lot,Positive
2023-08-12,London,Happy,"Back maintain high religious cause yard democratic business
set participant right more still director later maybe court the section job vote such along",Positive
2024-06-04,Tokyo,Anxious,"Per even camera road charge media personal rate through
event every information energy suggest training crime boy home country join small weight",Negative
2025-07-13,Bangalore,Anxious,Toward receive mean meeting hope begin girl so and month fund exist response street kid major foreign move,Negative
2025-04-03,Paris,Happy,Position defense against consumer week at present or just probably return,Neutral
2025-02-13,London,Excited,Population why position military recent public officer life wonder hold state argue,Negative
2025-01-23,Sydney,Tired,"Sister evening join end second popular reduce when fish sit into
until nature move peace since capital since car",Positive
2023-10-12,London,Anxious,Plan prove own focus american factor rich cover really blood argue best worry,Positive
2024-04-15,Paris,Excited,Relationship trade study voice able politics employee ready adult second purpose audience million whatever happy civil professional,Positive
2024-09-19,Tokyo,Sad,"Behind record remain east foreign every article eight direction for hair
big history today attack crime parent claim maintain writer study walk save yet",Negative
2025-05-22,Bangalore,Tired,Live left newspaper manager mind hotel sister,Positive
2025-01-03,Bangalore,Sad,Yeah remember save analysis mrs night turn trade deal brother early race reality say herself agreement threat paper practice,Positive
2024-05-04,Dubai,Angry,Clearly station even per culture letter but next language after good,Positive
2024-07-25,Sydney,Sad,"Nation bank raise place movement sure term young how benefit skin safe
down free picture party range natural win create mr toward",Positive
2024-02-01,Sydney,Peaceful,Former fact shake perhaps wish possible arrive prevent surface us heavy start other model arm art,Negative
2025-04-09,Sydney,Tired,Side especially office learn wind begin resource range kid future,Neutral
2023-07-25,Paris,Happy,Administration wonder both talk ok exactly sit next,Positive
2024-10-30,Tokyo,Happy,Toward read fly should cell capital response rate since result loss raise wait different affect scene partner include international,Positive
2025-03-06,Dubai,Angry,Painting history too safe economic top especially bar bag help writer trip form listen economic interview,Positive
2024-08-09,Tokyo,Anxious,Agree identify case no suddenly answer,Neutral
2023-11-24,London,Happy,Various really wide among officer,Negative
2024-12-05,Tokyo,Peaceful,Later generation your cell administration quality,Neutral
2023-10-17,London,Peaceful,Never add rate order item law president several body million organization film series force difference,Neutral
2024-07-11,Paris,Happy,Else above field tough upon perform style economic firm something particular figure future too soon like,Negative
2024-10-24,Sydney,Tired,Special no investment attack research various expert upon this month happen natural,Positive
2024-12-20,Bangalore,Peaceful,"Product several else during kind
fish employee resource able million also southern trouble letter fear resource service clearly this mention land",Positive
2025-04-29,Bangalore,Tired,Prevent brother themselves system market call car kitchen child food book open,Neutral
2024-01-21,Tokyo,Excited,"Table oil way set race result season back around table yet rich card
do use risk ten daughter firm could many oil amount
fight community report while sound point hundredextra",Positive
2024-03-01,Sydney,Happy,"Special reflect middle kind
teach seem size market do notice produce trip anyone scene son maintain three ever bed age dog listen it",Positive
2024-10-03,Sydney,Peaceful,Piece popular drop table leader sound skin must check,Positive
2024-03-12,Bangalore,Excited,Her no couple form less myself interest grow choice must serve under letter any now light wonder,Positive
2023-10-31,London,Peaceful,Outside look bodyextra,Neutral
2024-06-09,New York,Anxious,Avoid concern position offer house bank modern look notice case type,Positive
2024-01-09,Tokyo,Anxious,Different business range anything professional away do but tough heart set evening onto risk create provide learn everything,Negative
2024-03-20,Tokyo,Peaceful,"Along lawyer argue table they reflect focus president
radio employee you adult within trouble not single speak result now join none structure somebody base thought several become true",Negative
2024-12-29,London,Angry,Increase respond avoid national six she whose property subject among yard region recognize phone explain million character real close lay,Positive
2024-07-06,Sydney,Excited,Identify plan able edge man hour hit before become seven last himself sport design huge teacher rest be republican even lose lot environment cup view,Positive
2024-07-12,Dubai,Sad,Mission game source air total quality country social play,Negative
2024-12-02,Tokyo,Happy,Per address receive writer authority more under gun boy but race,Positive
2023-11-11,Dubai,Sad,Environmental easy sport ever could other allow similar difference discussion continue though large line,Positive
2023-07-24,Bangalore,Excited,Identify small black detail such even unit,Negative
2025-05-27,Dubai,Peaceful,Former point trip reduce in fly charge technology on improve especially market street carry before cost model,Positive
2024-11-28,Paris,Sad,"Economic morning play wall seven election physical make add long
wear that edge return prepare wall as bring present watch travel animal game recognize cover medical",Negative
2023-08-23,London,Anxious,Heart car assume let american throw whatever response since exactly such rule above hour doctor believe education,Neutral
2024-11-11,London,Excited,Receive door official itself reduce develop ago president stuff family reason face expect price film worry,Neutral
2025-04-28,Sydney,Happy,Reflect dinner fight meeting challenge someone since various hard law assume size,Negative
2023-08-09,Tokyo,Angry,"Chance drop sure too from choice
thing speak thousand sit glass place citizen forward ago improve son",Positive
2024-03-24,London,Peaceful,Glass medical worry produce admit onto partner,Neutral
2023-07-17,Paris,Excited,Whole model property turn past industry police executive,Negative
2023-11-04,Paris,Sad,"Discussion can service miss teach care attack force us wall outside different consumer him cultural professor painting management man
story serious ground",Negative
2025-04-11,New York,Tired,Right force get especially western top happen organization peace have for relationship smile meeting skill positive democratic amount,Positive
2023-09-22,New York,Anxious,Lot could away lead stage actually imagine wife would approach different power door beautiful medical all,Positive
2023-11-15,Dubai,Sad,Will positive network perhaps office record hear lose plan control,Positive
2024-11-28,Paris,Excited,"Nice special process threat run line game word door call
treatment run field night difficult fact information professor more high",Positive
2023-07-16,Bangalore,Tired,"Although magazine pass father send bag education moment
range western room market walk smile also hope nice firm study single his evening stand car",Positive
2025-01-16,Sydney,Excited,Spend sea organization west million box age support than,Neutral
2025-05-28,Paris,Tired,Explain shake require opportunity life ball sport compare soon address go,Neutral
2024-01-17,Sydney,Excited,"Entire newspaper financial democrat win week none
car option audience yeah third exist thing pick fire he call",Positive
2024-06-23,New York,Sad,Behavior everything read piece central but game yourself set real talk she state doctor individual no clear sign,Negative
2024-01-02,London,Tired,Quite position may performance worker head decade,Neutral
2025-05-17,Tokyo,Excited,Attorney he glass weight,Neutral
2023-12-26,New York,Excited,Play pick film risk add quickly maybe analysis could benefit writer institution box voice letter market view day,Positive
2024-02-07,Sydney,Angry,Serve middle eye decade something reason forward decision every brother hold throughout baby fill class program democratic beat,Neutral
2025-05-07,London,Angry,Evening stay end popular institution total again develop mother gun,Positive
2023-09-10,Tokyo,Sad,Four oil wait admit senior third provide response will federal drop share firm story public,Negative
2024-11-03,Tokyo,Happy,Care and its ball several discussion play safe relate feeling character see,Positive
2023-09-10,Bangalore,Excited,Federal prevent one enjoy recognize eat including any hope brother,Positive
2024-11-13,New York,Sad,Wall church walk public size article stuff participant stand garden wonder method summer reduce order,Neutral
2025-06-16,Tokyo,Excited,Seat lot minute decide start institution,Neutral
2023-09-20,Paris,Anxious,Staff option former activity wonder nation name night rangeextra,Neutral
2025-02-26,New York,Anxious,Card finish strong rock include democrat poor yourself girl technology tax start,Positive
2025-04-25,Bangalore,Excited,Source beat process itself six stay style understand,Neutral
2024-09-02,Bangalore,Anxious,Local miss plant travel draw step decide table body occur knowledge everything grow material need born,Neutral
2024-04-26,New York,Angry,"Candidate firm which their watch when probably than strong article whether
bag model generation begin very",Positive
2025-02-04,London,Angry,Attorney tonight house imagine more trip career,Positive
2024-01-04,Sydney,Happy,Responsibility share again cold way,Negative
2024-08-10,New York,Tired,Him edge great why store believe as understand,Positive
2023-08-20,Sydney,Tired,This probably clearly down rather perform safe boy show former garden sound address dinner,Positive
2024-06-19,London,Happy,Class project firm raise however note see training training item,Negative
2023-09-01,Dubai,Anxious,"Risk effort friend
carry he toward own successful by space store week term among find
on half this nothing design seek carry size role rich bar theory",Positive
2024-06-28,London,Angry,Cut get stay never visit hotel field,Neutral
2023-10-14,New York,Angry,Young use everyone tonight prevent do claim,Positive
2025-06-23,Tokyo,Happy,We good herself section dream gas third church put kitchen must,Positive
2023-12-27,Tokyo,Sad,Value step question each turn since win stage major many,Positive
2025-06-30,Tokyo,Excited,"Him government because lay indeed real board far nature back establish water serious traditional today
inside hard what oil hope personal eye song hotel relationship hit",Negative
2023-11-13,Sydney,Excited,Fill sure whole modern fire kind performance since country hear adult,Positive
2023-07-29,Sydney,Tired,Reach project town single raise fill property both,Negative
2023-10-10,Sydney,Excited,Wall option down serious hand heart,Negative
2024-11-19,Tokyo,Angry,Indeed agree great strong everything six back that least onto laugh rock arm data ok mission,Positive
2023-11-01,Tokyo,Peaceful,Ok order ball newspaper between five toward respond blue him wait interesting billion,Positive
2024-04-01,Dubai,Happy,All head check boy benefit inside field,Neutral
2024-08-19,London,Tired,Pass believe expert sound will base still view close travel here safe,Positive
2024-10-01,New York,Tired,Leg great director everybody beautiful opportunity interview tv nature remain central what,Positive
2023-09-02,London,Anxious,"Expect right military you boy it rock respond blue dinner city toward happy
education north suffer hot involve against article certain book present growth tv raise",Positive
2024-06-21,London,Sad,Act resource wall low choice purpose decide imagine,Neutral
2023-09-11,Paris,Angry,Bag expect far scientist candidate impact,Positive
2024-04-17,New York,Happy,"Free and foreign participant sea soldier reveal toward later even bed across military away town guess mouth
pay dark identify question exist",Positive
2025-03-24,Dubai,Tired,Summer glass full carry attorney our special likely peace make mind yeah face those call scientist father social knowledge senior return,Positive
2024-05-01,Dubai,Happy,"Happen step only benefit reality far audience explain science good light
help first bad example simple pattern key",Positive
2024-10-23,Dubai,Angry,"From now form usually star letter
owner himself south modern property ok sometimes mouth media man even industry color skin foot company",Positive
2025-04-11,New York,Anxious,Sort sense bank this yard challenge mother our peace direction kind assume its remain probably agreement although leave,Positive
2023-10-01,Bangalore,Excited,Reflect since general physical growth mother speak,Positive
2024-03-28,Bangalore,Peaceful,Side mother dream college bar hard blood treatment laugh result theory exist eight for,Positive
2024-12-29,Sydney,Tired,Turn wall author pay rule,Neutral
2024-04-27,Sydney,Peaceful,Small effect industry poor amount weight,Negative
2025-05-26,New York,Sad,"Season if particularly sort so and attack
director small suffer major home decide medical term",Negative
2024-05-10,Bangalore,Tired,Them oil already free bad benefit know stop ahead experience research free fast,Positive
2024-10-06,Bangalore,Tired,"Account old his mind soldier model
decide all own law specific pressure again chair player",Positive
2023-09-21,Tokyo,Tired,Movie film room you forget turn continue special hear make move in fall keep what,Positive
2024-06-22,Paris,Peaceful,Theory present network top admit news determine detail machine,Positive
2023-10-30,New York,Peaceful,Dark well who defense yeah statement box many public blue worker next foot real,Positive
2024-04-09,New York,Sad,"Old color carry born hard shake outside success blue
play morning wonder lay school nor responsibility suddenly",Positive
2025-06-09,New York,Excited,Blue all relationship billion near series top another conference traditional direction car information,Positive
2024-09-17,Sydney,Peaceful,Third clearly traditional tonight although newspaper mrs why you standard six,Neutral
2025-04-22,London,Angry,Ground important politics short nothing research reflect black how reach laugh into glass reduce summer,Positive
2024-12-16,Paris,Anxious,"Wide room red night local blue cup establish build send
remain couple floor sense sort response far seek teach top spend while raise under",Positive
2025-02-19,Tokyo,Excited,Director operation suddenly mind front accept prepare member level lead campaign total,Neutral
2024-11-13,New York,Excited,Company leave congress goal write assume,Neutral
2023-11-29,Tokyo,Happy,"Enough cold his cause
field community bring process will
whom peace job blue future low affect senior require spring",Negative
2024-04-25,Sydney,Happy,Course age nor program imagine test light important,Positive
2023-09-03,Paris,Peaceful,"Page morning course he often again box order small best lay
good return government hospital teach music they",Positive
