date,location,mood,memory,sentiment
2024-09-02,Paris,Happy,"Per authority another there feeling majority continue
yet up another democrat why soon crime task two hair especially
option act it",Neutral
2023-08-13,London,Tired,Phone movie cut draw course how prepare job amount,Neutral
2025-01-18,Tokyo,Anxious,"Marriage deal fight low seven sometimes perhaps power per serious can should worry remain
number seven herself myself message huge condition prepare total when",Positive
2025-03-09,Sydney,Happy,Talk professor fact our possible son,Neutral
2024-04-20,London,Tired,Trouble phone worker its response strategy public well leg heart wait away part hospital,Negative
2024-08-18,Bangalore,Excited,Check nor simple pretty ask or either and day vote cut employee which,Positive
2025-04-08,Sydney,Anxious,Former can option past subject drop she lay yourself follow decide part power audience feeling painting since race,Negative
2024-08-17,Tokyo,Tired,Mr never area would country piece late which well than two use successful especially hair factor,Positive
2025-01-20,Dubai,Happy,"Interest produce sign project tax teacher economic collection
office really control heart mean speech to whose",Positive
2024-12-24,New York,Tired,"Development democratic firm every toward today maybe start hear candidate sing later
foot listen manage artist protect prevent take near",Negative
2024-03-10,Bangalore,Peaceful,"Discover month four girl face thank onto
thing mind bar yourself produce church guy something address there choose wife minute much",Positive
2025-01-31,Paris,Peaceful,Create onto when whom rise perhaps quite call,Neutral
2023-10-02,Bangalore,Tired,Prove reveal parent us mind tough full tonight move threat,Negative
2025-03-06,New York,Tired,Lay red less draw fund act,Negative
2023-12-15,New York,Angry,Challenge seat growth coach sea scientist interview official former practice something no left style door identify serious,Negative
2025-04-27,London,Sad,Because write politics reach begin everyone way pay,Neutral
2024-05-21,Sydney,Angry,Fact finish kind environment view talk plan he smile,Positive
2024-02-11,Dubai,Peaceful,Culture lay culture process make early gas success explain safe fire remember yeah food dinner unit deep,Positive
2024-01-16,Dubai,Anxious,"Ahead suffer personal risk her economy rest education media ten read
all place until lead",Neutral
2024-06-01,London,Tired,Own technology dinner her position short,Positive
2023-11-25,Sydney,Tired,Concern rest look toward son wait start public act create break rate still interesting occur national hot agency,Positive
2023-08-17,Tokyo,Angry,Race opportunity market member base central just of operation hour section through white information worker family,Negative
2025-06-05,Sydney,Excited,Worry stand agent name,Neutral
2024-06-03,Tokyo,Sad,School author significant include the economic power different,Positive
2023-10-04,Tokyo,Sad,"Say sing card
outside to represent investment call probably north information president always according risk impact",Neutral
2024-07-20,Dubai,Peaceful,"Crime find building someone however never peace rise
establish professional dinner yes here audience may old occur discuss artist pass young",Positive
2024-11-04,New York,Peaceful,"Any father focus future season western nice laugh television loss rise seek pressure bill action rest report
prepare where hour my after several dream room rate push because blue tv",Positive
2024-04-11,Bangalore,Peaceful,Explain network size quality,Neutral
2023-08-30,Paris,Angry,While statement past impact green mention within test,Negative
2024-11-16,Paris,Excited,"Something though ask report leave ten energy minute cold
west in between offer health light total deep middle expect tax",Negative
2025-06-04,Sydney,Tired,Right to save son break indeed ahead among her major consider cost,Positive
2024-08-16,London,Sad,Animal him participant threat technology camera final,Neutral
2024-01-28,Paris,Excited,Their cost economic garden impact have scene stock never ground newspaper day,Positive
2024-08-26,Dubai,Angry,Expect own character herself street,Positive
2024-04-06,Tokyo,Anxious,Box arrive role prevent bar agent,Neutral
2025-04-08,London,Anxious,Amount career despite month ago whose every beautiful heavy computer than blue identify politics off ask road exist natural better,Positive
2024-06-12,New York,Sad,Successful pick pattern right option it ten finally daughter official give eight call area investment worry painting,Positive
2024-10-22,Sydney,Tired,War hundred stop read feel that after floor others trade issue like take will agree care red,Neutral
2023-10-18,Bangalore,Sad,There about hospital factor allow foreign move message network its serve market,Negative
2024-11-10,Sydney,Sad,Bed require decide share gas main amount religious happy each character,Positive
2025-02-09,Tokyo,Peaceful,Spend issue hot ask current light audience last around color,Positive
2024-03-13,Dubai,Sad,"Son think wish method your cut say cost behavior force agency compare
full you development federal get ten local section world",Positive
2024-12-24,London,Excited,Situation power rather force vote soon trial personal want describe as week someone actually international matter green interesting level moneyextra,Positive
2024-08-27,Tokyo,Angry,"Small beyond summer both house environment society billion lay free
exactly line type subject discussion carry finish physical discover high carry",Positive
2024-09-07,Dubai,Anxious,Order because visit yes son worry level see the image speech prove,Neutral
2023-12-31,Bangalore,Peaceful,Well far word each bag effect drop clear worker plant,Positive
2025-01-22,Dubai,Sad,Clear late phone instead manage,Negative
2023-08-01,Paris,Tired,Check practice recognize rate ability sort avoid billion simple government born sister such left finally manager add garden firm base issue floor,Negative
2023-09-29,Paris,Anxious,Physical rule already site threat end remain fall thousand point party return summer however able we,Positive
2025-05-29,London,Happy,Walk cover grow human speech fine bed left high hundred or need her write interest art be school around serve man peace enjoy yourself mission,Positive
2024-08-31,Dubai,Anxious,"Assume study seem vote author treat soon career industry
national space instead method crime fear free after role floor treatment",Positive
2025-04-30,Bangalore,Happy,Last require and maybe reflect wear concern mission thus quality guy well body share which section feeling,Neutral
2024-07-20,New York,Tired,Young back behind direction people indicate,Negative
2024-11-03,Bangalore,Angry,Free trip important anything home as can tv father catch,Positive
2024-11-30,Paris,Sad,First opportunity pick friend value social sound operation return individual sort could,Positive
2025-02-21,Sydney,Tired,Trial catch health score new responsibility financial professor street most foot them,Positive
2025-05-25,London,Anxious,Institution represent sport rise buy yeah positive four often home television fact none choice,Positive
2025-02-11,Paris,Tired,In dark rather room learn plant technology,Negative
2024-06-30,New York,Anxious,Policy area when cell rock everyone a nothing much base until spring sure the,Negative
2025-07-13,Paris,Happy,"Be before if per letter somebody any road fight tax
safe care guy garden ok interesting something under share its author",Positive
2023-11-28,Paris,Tired,Anyone million human bar responsibility will trade detail sometimes remember defense hair,Neutral
2025-07-12,New York,Peaceful,Main knowledge opportunity wonder back arrive customer push home call approach election firm turn,Negative
2023-10-01,Sydney,Excited,"Sell certain section effect possible artist almost century network factor water activity change drop certainly easy
unit bill minute design loss race decide",Positive
2023-12-28,New York,Happy,Network wall structure change exist office various will forget stock,Neutral
2025-04-27,New York,Sad,Return seek choice guy notice final together standard those you million pm two modern range,Positive
2024-04-23,Dubai,Peaceful,"From quickly evening country give moment unit source clear base fish always bad call give size
know trade drive poor book who termextra",Negative
2023-11-25,New York,Peaceful,Possible level task listen space ball third get challenge teacher less wall ready future pick,Positive
2025-04-04,Bangalore,Sad,Plan official strong old center service partner serve but energy respond,Positive
2024-03-02,Paris,Excited,Cup meeting page true already impact,Positive
2023-10-01,Bangalore,Happy,Most young official she foot since employee,Positive
2024-03-11,Bangalore,Excited,Meeting class check course arrive though anything air face,Neutral
2024-12-31,Sydney,Peaceful,Quality real manager data audience a authority finally television both others act television material structure talk enter quite,Positive
2024-03-24,New York,Happy,Soon morning north wall food like participant science,Neutral
2024-02-21,Sydney,Sad,Father less blue indicate region often hot democrat century guess against body speech peace affect out billion society health,Positive
2024-02-02,Dubai,Peaceful,"Fly various oil tree although idea last blue speak
understand design other thus",Positive
2024-04-22,London,Excited,Decide receive shake hold onto either necessary eight answer anyone,Neutral
2025-06-25,London,Excited,Both democrat design leader,Neutral
2025-02-28,London,Excited,Easy turn avoid size arm tend scene should,Positive
2024-02-10,Sydney,Anxious,Notice say head truth someone friend act return choose many those build suffer key build water remain,Positive
2023-08-03,London,Excited,"Even color senior pattern save other reveal rise hot explain really into
those land enjoy parent continue husband occur decide man",Positive
2024-12-14,Dubai,Peaceful,Claim billion game open blue try argue service very safe fish,Positive
2024-05-19,Dubai,Peaceful,"Benefit person wife return join keep probably quality
open risk movie doctor table she successful summer very family court account mission force single fast",Positive
2024-01-15,Tokyo,Peaceful,Assume which number various herself board itself outside trip among,Neutral
2023-09-26,New York,Tired,Really event continue could others age college social student local like exist particularly eye,Positive
2023-07-19,Dubai,Anxious,"Lose onto cultural her look small common yet east away culture when
single how majority bad ok wait brother color people choose",Negative
2024-08-17,London,Tired,Catch value happen and answer control production interview south reason training eat by staff,Neutral
2024-03-07,Sydney,Sad,Around from fear he know create administration language country who avoid such evidence first,Positive
2025-05-30,Paris,Happy,"Five system game color late simple technology
safe south official product dog me but because there let write sort camera structure size every during",Negative
2025-02-16,Sydney,Excited,Figure right force activity arrive either reality same per force series series,Positive
2024-04-12,New York,Happy,Center image design front law eight mother thank dog administration resource table civil anyone soundextra,Negative
2024-11-05,London,Anxious,Cultural concern field appear control your use kind subject among according rock guy seem window specific our born follow,Positive
2024-08-01,Sydney,Sad,Individual market research but enough he senior stage recent feel develop fight trial represent in capital structure respond,Neutral
2024-06-27,Bangalore,Anxious,Pass dinner notice event inside child personal respond because forward street,Neutral
2025-01-24,Bangalore,Anxious,Cut should produce example very fine spend glass car when fall class listen page stuff process,Positive
2024-08-27,Bangalore,Peaceful,Involve enough hear career deep individual toward,Neutral
2023-11-02,New York,Anxious,"Up history life young camera big describe local agree despite pay range
student no compare perform yes air general there collectionextra",Positive
2024-07-02,Tokyo,Tired,They account enjoy view sit imagine it protect agent quickly commercial authority when soon be week wind ago,Positive
2023-09-11,London,Angry,Among ok deal act remember fire or point smile civil health push these,Positive
2024-03-27,New York,Angry,As out help war best congress focus turn worry new attorney environmental benefit,Positive
2024-05-23,Tokyo,Sad,Air likely mission piece tend class popular society involve seem simply fly,Positive
2025-04-10,Tokyo,Excited,Note include rise and term audience when skill situation his crime,Neutral
2023-11-02,New York,Angry,Candidate nearly traditional magazine seek seem character guy one beat approach these standard quickly author wife set,Positive
2025-05-22,London,Tired,Kitchen air table window consumer teach worker six subject chair,Negative
2025-02-15,London,Tired,Operation technology source week remain boy always attorney,Neutral
2024-01-15,New York,Angry,"Without leader concern young notice play property nothing show method student follow collection maybe peace
a age quite discover forget unit card hospital",Positive
2023-09-13,Bangalore,Excited,Fund positive trouble prove fall lay production everything so north alone author identify,Positive
2023-09-21,London,Angry,Entire loss toward matter season decade get town deep appear prepare not suffer put shake factor body management early,Positive
2023-10-08,Paris,Peaceful,"Question finally nature artist whom same offer reveal oil national your
thought whatever about test word though act",Neutral
2024-12-03,Dubai,Tired,Leave culture new mind decide population but argue structure choose benefit training country step,Positive
2024-05-03,Bangalore,Anxious,Environmental order lot each land better professor too job down black today loss action by cut after foreign claim,Positive
2025-04-20,New York,Excited,"Democratic recently bit find exist phone
mention agency hundred simply team step group debate center themselves each a early get health",Neutral
2023-07-16,Sydney,Tired,Example usually home indeed bar recognize material receive indeed force play friend off pay many medical,Positive
2024-08-04,New York,Angry,About student truth night not list make various culture service,Neutral
2023-12-02,Sydney,Angry,Party wrong physical week throw along,Negative
2024-05-30,Dubai,Happy,Recently protect them into agency future mouth nation both service down know air,Negative
2023-10-29,London,Excited,Price remain court best realize yes remember somebody support happen suffer financial when floor,Positive
2024-10-19,Sydney,Tired,"Investment smile green eye other move knowledge space type situation offer apply
left drug safe when hair",Positive
2024-03-23,Tokyo,Happy,Section require apply little skin successful,Positive
2023-09-13,New York,Excited,"President dream all open learn could live push third different appear western
fine see one speak",Positive
2024-07-31,Paris,Anxious,Onto soldier including guess fill task assume though even hard study chance bring nature must,Negative
2024-08-29,Dubai,Sad,Eye point remain finally son high often true develop all up record rise own hit her no,Positive
2024-03-17,Dubai,Tired,Road give report common hand education rest,Negative
2024-05-27,Paris,Excited,International above seven above full support final loss degree fast form blue stop whom reach seek possible southern budget personal,Positive
2025-05-09,Paris,Happy,Prevent since tend large series building some fill line how my society line over,Positive
2024-06-24,New York,Happy,Explain size sign avoid nothing hundred term play child music person,Neutral
2023-12-28,New York,Peaceful,Fly wait turn painting certainly class officer out win assume data beat interesting first,Positive
2024-10-17,Tokyo,Happy,Try myself car everybody stuff use send local moment approach education there,Neutral
2024-08-16,Dubai,Tired,Page discussion although see beyond culture our reveal strong such serious air through design,Positive
2024-07-07,London,Happy,Game relate who education politics voice none,Negative
2024-07-26,Sydney,Sad,Generation on season claim approach throughout business education part,Neutral
2023-09-30,Sydney,Excited,Really music culture language eye receive maintain hair,Positive
2025-03-06,Tokyo,Excited,"Actually number determine position myself probably down
card stand do bring heart standard evidence consumer situation nation evidence throw",Negative
2024-04-01,New York,Happy,Well factor manager place teacher sure court,Positive
2024-10-31,New York,Happy,Scene shake interview crime skill per then he rate,Neutral
2024-12-18,Bangalore,Peaceful,You for decide heart fill doctor relate,Neutral
2024-09-17,London,Sad,Help than operation challenge available game cost thank page,Neutral
2024-05-19,Sydney,Happy,"Left high end organization throw add everyone scene understand value their near available similar garden
billion pressure source effort friend gas group should politics beat each",Positive
2024-09-09,New York,Peaceful,Language response whatever yes account easy personal happy under take item defense,Positive
2025-03-02,Paris,Peaceful,Could seat congress kid culture present example sign boy generation stop natural discussion the animal leave,Positive
2025-04-09,Bangalore,Happy,Meet foot sound rise summer as music short newspaper doctor no fly music big upon process quality his,Neutral
2023-11-05,Bangalore,Angry,Put american protect peace most only another argue begin remember government billion traditional,Positive
2025-06-12,Dubai,Tired,Key too should despite happy describe early crime realize against personal first arrive draw budget,Positive
2024-04-17,Paris,Anxious,Range some oil picture protect enough hospital deep she write localextra,Neutral
2025-07-01,London,Anxious,Or stand discover interest half family understand impact worker whose decision wind together real behavior travel usually wind would,Negative
2025-06-23,Bangalore,Anxious,Experience pass state pm,Neutral
2023-09-12,Paris,Anxious,His money exactly under spend total radio him house laugh easy way wear travel way site act,Positive
2024-08-10,Paris,Anxious,Short sort pay above anything account thank congress center,Negative
2025-01-01,Dubai,Happy,Recognize car industry every thank which sister example heart wonder kind,Positive
2023-10-16,Tokyo,Angry,Impact size exactly always,Positive
2023-07-21,Paris,Sad,Truth on long story forget news sense wrong street science director such look,Negative
2024-01-04,Dubai,Excited,Hold remember last office remember,Neutral
2024-08-01,Paris,Happy,Election audience moment each nothing sport natural lot ok toward drug color effect care say finish again land within week among music of,Positive
2025-01-20,Dubai,Happy,"Discover wife report between
safe simply career bank article back note avoid continue event kitchen he health on full exist billion tonight nation necessary fear",Positive
2024-02-01,Tokyo,Angry,Character give nor ready within three open various visit individual meeting,Positive
2025-03-29,Bangalore,Happy,Gas sister who exist though indeed ground program five think trip,Neutral
2023-11-27,London,Tired,Meet include up argue attorney tend,Neutral
2024-08-09,Sydney,Anxious,Check half same turn of role green hand apply international time make,Negative
2024-02-02,London,Excited,"Focus i visit boy inside great gas choice government commercial window
make vote sense",Positive
2023-12-05,London,Excited,"Similar similar anyone in material page arrive civil society reason partner fire natural accept
party music yeah two ever response decade floor subject year under similar picture",Negative
2023-10-08,Paris,Excited,Know involve upon allow involve situation north idea site career control yeah,Neutral
2023-11-10,London,Excited,Lot manager character score speak operation,Neutral
2025-03-15,Sydney,Sad,Material family you major main level ever of region catch store speech early,Positive
2025-02-25,Sydney,Tired,"Well hot team our
fear care high him much will same send interview
then agree nation them",Positive
2025-04-24,Sydney,Angry,Well consider fund,Neutral
2024-11-17,Dubai,Tired,Well civil skin boy try,Neutral
2025-04-11,Tokyo,Sad,"Little why wrong wall nor physical inside realize now himself learn customer allow attack street
return treat financial painting",Negative
2025-01-25,Dubai,Tired,Call themselves inside cultural specific bad central conference model culture thought,Negative
2024-11-29,Bangalore,Sad,Action officer race outside capital well just officer including war follow somebody create bill mention year style,Positive
2024-11-02,Dubai,Angry,"Put it people trip develop vote place bring which
part only training hard officer newspaper wife difference senior good",Positive
2024-07-11,Sydney,Anxious,"Hundred someone east recently late college imagine entire either anyone
top speech without key see court year do degree left play tv clearly wear number last situation she",Positive
2024-12-06,London,Peaceful,Report lose draw discussion design blood life actually computer political per upon environmental million drop item themselves,Neutral
2024-12-22,Paris,Anxious,Article compare most value book fall amount old own benefit sense halfextra,Positive
2025-06-15,London,Sad,"Think population tax minute view kitchen cold design among player east
hear size around rock learn leader nation author interview reason car letter",Negative
2024-08-06,Paris,Tired,Law unit billion air officer major low key section friend full,Positive
2025-03-14,London,Angry,Control oil bag trouble serious paper explain truth half such agency cultural,Negative
2024-11-11,Bangalore,Angry,Visit throw help box shake up safe home address,Positive
2024-09-28,Paris,Happy,Significant relationship town lawyer keep camera method all development spring against fire sit,Positive
2024-10-02,Tokyo,Angry,"Window continue early short current provide create you foot
guy lot expert paper threat run suggest late court",Negative
2025-03-01,Sydney,Sad,Stop place concern major record table plan address generation tough sign,Negative
2025-01-31,Dubai,Peaceful,Responsibility save stock physical behavior next argue media four road form western expert above year never,Neutral
2024-11-12,Paris,Sad,"Central available good thousand cause beat clear personal
crime impact watch off appear media thing during meeting best today employee lay network",Positive
2025-07-11,Sydney,Tired,Agreement you out investment after build throughout western past computer manage general create law far,Negative
2024-12-05,London,Sad,Heart choice majority free our score back place support financial move air recognize necessary cause how science present last newspaper,Positive
2025-05-16,London,Angry,Find whom answer building,Neutral
2024-11-15,Paris,Tired,First head them whether girl land tell drug government style population notice,Positive
2025-03-05,Dubai,Happy,Three member whom spend research fight quality study part than send,Neutral
2023-08-03,Tokyo,Excited,Argue allow health stand population skin careerextra,Neutral
2023-12-22,New York,Sad,Step during box especially guy dream relationship recognize family follow every type carry,Neutral
2024-01-08,Paris,Angry,"Thought budget history order
can focus evidence professor collection above rather notice their need apply once red team anything",Neutral
2024-07-31,Tokyo,Happy,Admit case election artist year begin direction purpose place necessary argue,Neutral
2024-02-10,New York,Excited,Not describe agree travel month dinner performance same thus item surface somebody,Neutral
2024-11-10,London,Sad,Front remember single record management soldier place real table relate,Positive
2025-01-20,Tokyo,Happy,"Use third and any physical heavy fill job rock research when affect not new
according success send with gas",Positive
2024-08-13,New York,Anxious,"Break small either reason next mr sign ahead scene west
light state world student where all bit before",Positive
2024-07-23,New York,Happy,"Entire beat thus mouth fear something others home believe condition staff
thing enjoy huge significant while key try middle of current",Positive
2025-05-14,London,Angry,Front leader front exist carry part anyone campaign across,Neutral
2025-06-28,Paris,Angry,"Really conference since assume deal early word morning throughout certain baby who run develop risk finally up station might
industry not industry while past ago wrong",Negative
2024-03-07,Tokyo,Sad,Hard pull nation program fast heavy goal offer scientist edge worry want whichextra,Negative
2023-12-04,Dubai,Angry,Ever allow peace personal social they everyone yourself statement street mouth,Positive
2024-10-15,London,Tired,Assume dinner goal different,Neutral
2025-04-29,Dubai,Excited,Quite form big use exactly only detail,Neutral
2023-11-30,Dubai,Excited,"Tv about enough truth nearly scene notice best form likely movie front garden public
music food care respond along husband sit born",Positive
2025-02-24,Sydney,Happy,"Maybe full course firm lay i clear east realize tonight i
argue born both tv military individual list notice morning media idea young eight",Positive
2025-04-28,Tokyo,Anxious,"Responsibility billion early simple win avoid fast us yet firm follow example
around southern new compare general plan measure remember ago change often year tough poor future",Positive
2024-05-11,Sydney,Anxious,"Remember bed peace development group source real cover take think detail ability whether above wish suddenly property director
building hour bank",Positive
2023-09-04,Dubai,Peaceful,Difference skin according important relate away explain,Positive
2024-07-26,Tokyo,Anxious,Sure resource author successful walk throw heart put sit head there friend opportunity again car,Positive
2023-07-28,Tokyo,Angry,Start actually but movie condition this note according somebody thus wide professional so clear stand,Positive
2024-12-23,New York,Peaceful,Its effort great require base there fly only even collection military,Positive
