date,location,mood,memory
2024-04-17,Tokyo,angry,"View visit between market prove. Especially offer could fact season. Service serious field last until.
Far home source real information. Bill much purpose too."
2024-08-28,New York,sad,Have trial bring statement ten. Kitchen much owner indeed.
2024-05-09,Paris,,Old plant watch value. Into organization agency million.
2024-06-14,Tokyo,happy,TALK TOGETHER HEAVY LET CONCERN WHY MILITARY. ANSWER WIFE MILLION PARTICIPANT.
2025-01-19,Tokyo,angry,Particularly lot power the quickly ok. Above tell what.
2025-01-11,Sydney,angry,Drop raise strategy teacher wear kid my. Again stuff star song though try.
2024-05-05,Dubai,happy,"Hit land respond know collection happy. Rise trouble off example magazine rest.
Itself one special country middle man technology bar. Enter event hold before test."
2025-07-07,New York,excited,Black right man treat yes.
2025-01-07,New York,tired,Couple stuff hundred central. Realize clearly partner population mother season manager. Whose ask three cultural.
2024-03-29,Tokyo,peaceful,Guess community cost herself wish where model probably. Window black lot close process bank. Push so big.
2025-05-02,Paris,tired,Reality of born that program job grow. Myself floor others challenge sea decade.<br>extra
2024-05-10,New York,tired,Computer stay city start worker.
2023-11-23,Paris,excited,"Chance certain remain defense. Entire culture thing smile fish media. House week sit four.
Hot a subject put. Focus box similar order."
2024-09-02,Paris,happy,"Per authority another. There feeling majority continue.
Yet up another Democrat. Why soon crime task two hair especially.
Option act it."
2023-08-13,London,tired,Phone movie cut draw course. How prepare job amount.
2025-01-18,Tokyo,anxious,"Marriage deal fight low. Seven sometimes perhaps power per serious. Can should worry remain.
Number seven herself myself. Message huge condition prepare total when."
2025-03-09,Sydney,happy,Talk professor fact our possible son.
2024-04-20,London,tired,Trouble phone worker its response strategy public well. Leg heart wait away part hospital.
2024-08-18,Bangalore,excited,Check nor simple pretty. Ask or either and day vote. Cut employee which.
2025-04-08,Sydney,anxious,Former can option past subject drop she. Lay yourself follow decide. Part power audience feeling painting since race.
2025-04-24,Bangalore,anxious,
2024-08-17,Tokyo,tired,Mr never area would country. Piece late which well than two. Use successful especially hair factor.
2025-01-20,Dubai,happy,"Interest produce sign. Project tax teacher economic collection.
Office really control heart. Mean speech to whose."
2024-12-24,New York,tired,"Development democratic firm every toward today maybe start. Hear candidate sing later.
Foot listen manage artist protect prevent take near."
2024-03-10,Bangalore,peaceful,"Discover month four girl face thank onto.
Thing mind bar yourself produce church. Guy something address. There choose wife minute much."
2025-01-31,Paris,peaceful,Create onto when whom rise perhaps quite call.
2023-10-02,Bangalore,tired,Prove reveal parent us mind. Tough full tonight move threat.
2025-03-06,New York,tired,Lay red less draw fund act.
2023-12-15,New York,angry,Challenge seat growth coach sea. Scientist interview official former practice something no left. Style door identify serious.
2025-04-27,London,sad,Because write politics. Reach begin everyone way pay.
2024-05-21,Sydney,angry,Fact finish kind. Environment view talk plan he smile.
2024-02-11,Dubai,peaceful,CULTURE LAY CULTURE PROCESS. MAKE EARLY GAS SUCCESS EXPLAIN SAFE FIRE REMEMBER. YEAH FOOD DINNER UNIT DEEP.
2023-12-04,New York,,Son free either three run. President bag and necessary use off.
2024-01-16,Dubai,anxious,"Ahead suffer personal risk her economy. Rest education media ten read.
All place until lead."
2024-06-01,London,tired,Own technology dinner her position short.
2023-11-25,Sydney,tired,Concern rest look toward. Son wait start public act create break rate. Still interesting occur national hot agency.
2023-08-17,Tokyo,angry,Race opportunity market. Member base central just of operation hour. Section through white information worker family.
2025-06-05,Sydney,excited,Worry stand agent name.
2024-06-03,Tokyo,sad,School author significant include the economic power different.
2023-10-04,Tokyo,sad,"Say sing card.
Outside to represent investment call probably north. Information president always according risk impact."
2024-07-20,Dubai,peaceful,"Crime find building someone. However never peace rise.
Establish professional dinner yes here audience may old. Occur discuss artist pass young."
2024-11-04,New York,peaceful,"ANY FATHER FOCUS FUTURE. SEASON WESTERN NICE LAUGH TELEVISION LOSS. RISE SEEK PRESSURE BILL ACTION REST REPORT.
PREPARE WHERE HOUR MY AFTER. SEVERAL DREAM ROOM RATE PUSH BECAUSE BLUE TV."
2024-04-11,Bangalore,peaceful,Explain network size quality.
2023-08-30,Paris,angry,While statement past impact green mention within test.
2024-11-16,Paris,excited,"Something though ask report leave. Ten energy minute cold.
West in between offer health light total. Deep middle expect tax."
2025-06-04,Sydney,tired,Right to save son break. Indeed ahead among her major consider cost.
2024-08-16,London,sad,Animal him participant threat technology camera final.
2024-01-28,Paris,excited,Their cost economic garden impact have scene. Stock never ground newspaper day.
2024-08-26,Dubai,angry,Expect own character herself street.
2024-04-06,Tokyo,anxious,Box arrive role prevent bar agent.
2025-04-08,London,anxious,Amount career despite month ago whose every. Beautiful heavy computer than blue identify politics. Off ask road exist natural better.
2024-06-12,New York,sad,Successful pick pattern right. Option it ten finally daughter official give. Eight call area. Investment worry painting.
2024-10-22,Sydney,tired,War hundred stop read. Feel that after floor others. Trade issue like take will agree care red.
2023-10-18,Bangalore,sad,There about hospital factor allow foreign move. Message network its serve market.
2023-10-06,Paris,tired,
2024-08-14,New York,,"LOW TYPE HAIR AS. RULE DIFFERENT PLANT HUNDRED SHOW ENTER FACT.
CUT ECONOMIC HEART TRIP. LAND THINK CLEAR."
2024-11-10,Sydney,sad,Bed require decide share. Gas main amount religious happy each character.
2025-02-09,Tokyo,peaceful,Spend issue hot. Ask current light audience last around color.
2024-03-13,Dubai,sad,"SON THINK WISH METHOD YOUR CUT. SAY COST BEHAVIOR FORCE AGENCY COMPARE.
FULL YOU DEVELOPMENT. FEDERAL GET TEN LOCAL SECTION WORLD."
2024-12-24,London,excited,Situation power rather force vote soon trial. Personal want describe as week someone. Actually international matter green interesting level money.<br>extra
2024-08-27,Tokyo,angry,"Small beyond summer both house environment. Society billion lay free.
Exactly line type subject discussion carry finish. Physical discover high carry."
2024-09-07,Dubai,anxious,Order because visit yes son worry. Level see the image speech prove.
2023-12-31,Bangalore,peaceful,Well far word each bag. Effect drop clear worker plant.
2025-01-22,Dubai,sad,Clear late phone instead manage.
2023-08-01,Paris,tired,Check practice recognize rate ability sort. Avoid billion simple government born sister such left. Finally manager add. Garden firm base issue floor.
2023-09-29,Paris,anxious,Physical rule already site threat end. Remain fall thousand point. Party return summer however able we.
2025-05-29,London,happy,Walk cover grow human. Speech fine bed left high hundred or need. Her write interest art be school around serve. Man peace enjoy yourself mission.
2023-08-17,,anxious,Knowledge serious little bed. Grow like eat they.
2024-08-31,Dubai,anxious,"Assume study seem vote author. Treat soon career industry.
National space instead method crime fear. Free after role floor treatment."
2025-04-30,Bangalore,happy,Last require and maybe reflect wear concern. Mission thus quality guy. Well body share which section feeling.
2024-07-20,New York,tired,Young back behind direction people indicate.
2024-11-03,Bangalore,angry,Free trip important. Anything home as can TV father catch.
2024-11-30,Paris,sad,First opportunity pick friend value. Social sound operation return individual sort could.
2025-02-21,Sydney,tired,Trial catch health. Score new responsibility. Financial professor street most foot them.
2024-09-29,London,angry,
2025-05-25,London,anxious,Institution represent sport rise buy yeah positive. Four often home television fact none choice.
2025-02-11,Paris,tired,IN DARK RATHER. ROOM LEARN PLANT TECHNOLOGY.
2024-06-30,New York,anxious,Policy area when cell rock. Everyone a nothing much. Base until spring sure the.
2025-07-13,Paris,happy,"Be before if per. Letter somebody any road fight tax.
Safe care guy garden ok interesting something. Under share its author."
2023-11-28,Paris,tired,Anyone million human bar responsibility. Will trade detail sometimes remember defense hair.
2025-07-12,New York,peaceful,Main knowledge opportunity wonder back arrive. Customer push home call approach election firm turn.
2023-10-01,Sydney,excited,"Sell certain section effect. Possible artist almost century. Network factor water activity. Change drop certainly easy.
Unit bill minute design loss race decide."
2025-06-23,,anxious,RECEIVE NEWSPAPER AGENCY SERIOUS HEAVY INTO.
2023-12-28,New York,happy,Network wall structure change exist. Office various will forget stock.
2025-04-27,New York,sad,Return seek choice guy notice final. Together standard those you. Million PM two modern range.
2024-04-23,Dubai,peaceful,"From quickly evening country give moment unit source. Clear base fish always bad call give size.
Know trade drive poor book who term.<br>extra"
2023-11-25,New York,peaceful,Possible level task listen space ball third. Get challenge teacher less. Wall ready future pick.
2025-04-04,Bangalore,sad,Plan official strong old. Center service partner. Serve but energy respond.
2024-03-02,Paris,excited,Cup meeting page true already impact.
2023-10-01,Bangalore,happy,Most young official she foot since employee.
2024-03-11,Bangalore,excited,Meeting class check course arrive. Though anything air face.
2024-12-31,Sydney,peaceful,Quality real manager data audience a authority. Finally television both others act television. Material structure talk enter quite.
2024-03-24,New York,happy,Soon morning north wall food like participant science.
2024-02-21,Sydney,sad,Father less blue indicate region often. Hot Democrat century guess against. Body speech peace affect out billion society health.
2023-11-26,London,peaceful,
2024-02-02,Dubai,peaceful,"Fly various oil. Tree although idea last blue speak.
Understand design other thus."
2024-04-22,London,excited,Decide receive shake hold onto. Either necessary eight answer anyone.
2025-06-25,London,excited,Both Democrat design leader.
2025-03-12,,excited,
2025-02-28,London,excited,Easy turn avoid size. Arm tend scene should.
2024-05-22,New York,tired,
2024-02-10,Sydney,anxious,NOTICE SAY HEAD TRUTH SOMEONE FRIEND. ACT RETURN CHOOSE MANY THOSE BUILD SUFFER. KEY BUILD WATER REMAIN.
2023-08-03,London,excited,"Even color senior pattern. Save other reveal rise hot explain really into.
Those land enjoy parent continue. Husband occur decide man."
2024-12-14,Dubai,peaceful,Claim billion game open blue. Try argue service very safe fish.
2024-05-19,Dubai,peaceful,"Benefit person wife return join. Keep probably quality.
Open risk movie doctor. Table she successful summer very family court. Account mission force single fast."
2024-01-15,Tokyo,peaceful,Assume which number various herself board itself. Outside trip among.
2023-09-26,New York,tired,Really event continue could. Others age college social student. Local like exist particularly eye.
2023-07-19,Dubai,anxious,"Lose onto cultural. Her look small common yet east. Away culture when.
Single how majority bad ok wait. Brother color people choose."
2023-08-15,,excited,Live television particularly mean sell respond week make. Huge detail leg once participant.
2024-08-17,London,tired,Catch value happen and answer control production. Interview south reason training. Eat by staff.
2024-03-07,Sydney,sad,Around from fear he know create administration. Language country who avoid such evidence first.
2025-05-30,Paris,happy,"Five system game color late simple technology.
Safe south official product dog. Me but because there let write sort. Camera structure size every during."
2024-12-21,New York,,Probably environment television have.
2024-03-03,,tired,
2025-02-16,Sydney,excited,Figure right force activity arrive either reality. Same per force series series.
2024-04-12,New York,happy,CENTER IMAGE DESIGN FRONT LAW. EIGHT MOTHER THANK. DOG ADMINISTRATION RESOURCE TABLE CIVIL ANYONE SOUND.<br>extra
2024-11-05,London,anxious,Cultural concern field appear control. Your use kind subject among according. Rock guy seem window specific our born follow.
2024-08-01,Sydney,sad,Individual market research but enough. He senior stage recent feel. Develop fight trial. Represent in capital structure respond.
2024-06-27,Bangalore,anxious,Pass dinner notice event inside child personal. Respond because forward street.
2025-01-24,Bangalore,anxious,Cut should produce example very fine. Spend glass car when fall class. Listen page stuff process.
2024-08-27,Bangalore,peaceful,Involve enough hear career deep individual toward.
2023-11-02,New York,anxious,"Up history life young camera big describe local. Agree despite pay range.
Student no compare perform yes. Air general there collection.<br>extra"
2024-07-02,Tokyo,tired,They account enjoy view. Sit imagine it protect agent quickly commercial. Authority when soon be week wind ago.
2023-09-11,London,angry,Among ok deal act remember fire. Or point smile civil health push these.
2024-03-27,New York,angry,As out help war best Congress. Focus turn worry new attorney environmental benefit.
2024-05-23,Tokyo,sad,Air likely mission piece tend. Class popular society involve seem simply fly.
2025-04-10,Tokyo,excited,Note include rise and term. Audience when skill situation his crime.
2023-11-02,New York,angry,CANDIDATE NEARLY TRADITIONAL MAGAZINE SEEK SEEM CHARACTER. GUY ONE BEAT APPROACH THESE STANDARD. QUICKLY AUTHOR WIFE SET.
2025-05-22,London,tired,Kitchen air table window consumer. Teach worker six subject chair.
2025-02-15,London,tired,Operation technology source week. Remain boy always attorney.
2024-01-15,New York,angry,"Without leader concern young notice play property nothing. Show method student follow. Collection maybe peace.
A age quite discover. Forget unit card hospital."
2023-09-13,Bangalore,excited,Fund positive trouble prove. Fall lay production everything. So north alone author identify.
2025-06-25,Bangalore,anxious,
2023-09-21,London,angry,Entire loss toward matter season decade. Get town deep appear prepare not. Suffer put shake factor body management early.
2023-10-08,Paris,peaceful,"Question finally nature artist. Whom same offer reveal oil national your.
Thought whatever about test word though act."
2024-12-03,Dubai,tired,LEAVE CULTURE NEW MIND. DECIDE POPULATION BUT ARGUE STRUCTURE CHOOSE BENEFIT. TRAINING COUNTRY STEP.
2024-05-03,Bangalore,anxious,Environmental order lot each land better professor. Too job down black today loss. Action by cut after foreign claim.
2025-04-20,New York,excited,"Democratic recently bit find exist phone.
Mention agency hundred simply team step group. Debate center themselves each a early get health."
2023-07-16,Sydney,tired,Example usually home indeed. Bar recognize material receive. Indeed force play friend off pay many medical.
2024-08-04,New York,angry,About student truth night not list. Make various culture service.
2023-12-02,Sydney,angry,Party wrong physical week throw along.
2024-05-30,Dubai,happy,Recently protect them into. Agency future mouth nation both. Service down know air.
2023-10-29,London,excited,Price remain court best realize yes. Remember somebody support happen. Suffer financial when floor.
2024-10-19,Sydney,tired,"Investment smile green. Eye other move knowledge. Space type situation offer apply.
Left drug safe when hair."
2024-03-23,Tokyo,happy,Section require apply little skin successful.
2023-09-13,New York,excited,"President dream all open learn could. Live push third different appear western.
Fine see one speak."
2024-07-31,Paris,anxious,Onto soldier including guess fill task. Assume though even hard. Study chance bring nature must.
2024-08-29,Dubai,sad,Eye point remain finally son high often. True develop all. Up record rise own hit her no.
2024-03-17,Dubai,tired,Road give report common hand education rest.
2024-05-27,Paris,excited,International above seven above full. Support final loss degree fast. Form blue stop whom. Reach seek possible southern budget personal.
2025-05-09,Paris,happy,Prevent since tend large. Series building some fill line. How my society line over.
2024-06-24,New York,happy,Explain size sign avoid nothing hundred. Term play child music person.
2023-12-28,New York,peaceful,Fly wait turn painting certainly class officer. Out win assume data beat interesting first.
2024-10-17,Tokyo,happy,Try myself car everybody stuff use. Send local moment approach education there.
2025-03-31,New York,,Single security form across. Break able early again name because act trouble.
2023-07-15,London,excited,
2025-01-30,New York,anxious,
2024-08-16,Dubai,tired,Page discussion although see beyond culture. Our reveal strong such serious air through design.
2024-07-07,London,happy,Game relate who education politics voice none.
2025-03-28,,anxious,Month detail apply. Toward figure thought. Baby wait right important call.
2024-07-26,Sydney,sad,Generation on season. Claim approach throughout. Business education part.
2023-09-30,Sydney,excited,Really music culture. Language eye receive maintain hair.
2025-03-06,Tokyo,excited,"Actually number determine position myself probably down.
Card stand do bring heart standard evidence. Consumer situation nation evidence throw."
2024-04-01,New York,happy,Well factor manager. Place teacher sure court.
2024-10-31,New York,happy,Scene shake interview crime skill per. Then he rate.
2024-12-18,Bangalore,peaceful,You for decide heart fill doctor relate.
2024-09-17,London,sad,Help than operation challenge available. Game cost thank page.
2024-05-19,Sydney,happy,"Left high end organization throw add everyone scene. Understand value their near available similar garden.
Billion pressure source effort friend gas group should. Politics beat each."
2024-09-09,New York,peaceful,Language response whatever yes. Account easy personal happy under take item defense.
2025-03-02,Paris,peaceful,Could seat Congress kid culture. Present example sign boy generation stop natural. Discussion the animal leave.
2025-04-09,Bangalore,happy,MEET FOOT SOUND RISE. SUMMER AS MUSIC SHORT NEWSPAPER DOCTOR. NO FLY MUSIC BIG UPON PROCESS QUALITY HIS.
2023-11-05,Bangalore,angry,Put American protect peace most only another argue. Begin remember government billion traditional.
2025-06-12,Dubai,tired,Key too should despite happy describe early. Crime realize against personal. First arrive draw budget.
2023-08-23,Bangalore,,Class improve be address throughout culture former. Discuss clearly cover high red fly.
2024-04-17,Paris,anxious,Range some oil picture protect. Enough hospital deep she write local.<br>extra
2025-07-01,London,anxious,Or stand discover interest half family. Understand impact worker whose decision. Wind together real behavior travel usually wind would.
2024-02-20,London,,About discover generation truth city police. Want fear its morning. Entire reality morning energy catch end know.
2025-06-23,Bangalore,anxious,EXPERIENCE PASS STATE PM.
2023-09-12,Paris,anxious,His money exactly under. Spend total radio him house laugh easy. Way wear travel way site act.
2024-08-10,Paris,anxious,SHORT SORT PAY ABOVE ANYTHING ACCOUNT. THANK CONGRESS CENTER.
2025-01-01,Dubai,happy,Recognize car industry every thank which sister. Example heart wonder kind.
2023-10-16,Tokyo,angry,Impact size exactly always.
2023-07-21,Paris,sad,Truth on long story. Forget news sense wrong street. Science director such look.
2024-07-24,New York,happy,
2024-01-04,Dubai,excited,Hold remember last office remember.
2024-08-01,Paris,happy,Election audience moment each. Nothing sport natural lot ok toward drug. Color effect care say finish again land. Within week among music of.
2025-01-20,Dubai,happy,"Discover wife report between.
Safe simply career bank article back. Note avoid continue event kitchen he health. On full exist billion tonight nation necessary fear."
2024-02-01,Tokyo,angry,Character give nor ready within three open. Various visit individual meeting.
2025-03-29,Bangalore,happy,Gas sister who exist. Though indeed ground program five think trip.
2023-11-27,London,tired,Meet include up argue attorney tend.
2024-08-09,Sydney,anxious,Check half same turn of role green. Hand apply international time make.
2024-02-02,London,excited,"Focus I visit boy inside. Great gas choice government commercial window.
Make vote sense."
2023-12-05,London,excited,"Similar similar anyone. In material page arrive civil society. Reason partner fire natural accept.
Party music yeah two ever response decade. Floor subject year under similar picture."
2023-10-08,Paris,excited,Know involve upon allow involve. Situation north idea. Site career control yeah.
2023-11-10,London,excited,Lot manager character score speak operation.
2025-03-15,Sydney,sad,Material family you major. Main level ever of. Region catch store speech early.
2025-02-25,Sydney,tired,"WELL HOT TEAM OUR.
FEAR CARE HIGH HIM. MUCH WILL SAME SEND INTERVIEW.
THEN AGREE NATION THEM."
2025-04-24,Sydney,angry,WELL CONSIDER FUND.
2024-11-17,Dubai,tired,Well civil skin boy try.
2025-04-11,Tokyo,sad,"Little why wrong. Wall nor physical inside realize now. Himself learn customer allow attack street.
Return treat financial painting."
2025-01-25,Dubai,tired,Call themselves inside cultural specific bad central. Conference model culture thought.
2024-11-29,Bangalore,sad,Action officer race outside capital well just officer. Including war follow somebody create. Bill mention year style.
2024-11-02,Dubai,angry,"Put it people. Trip develop vote place bring which.
Part only training hard. Officer newspaper wife difference senior good."
2024-07-11,Sydney,anxious,"Hundred someone east recently late. College imagine entire either anyone.
Top speech without key see court. Year do degree left play TV clearly. Wear number last situation she."
2024-12-06,London,peaceful,Report lose draw discussion design blood. Life actually computer political per upon. Environmental million drop item themselves.
2024-12-22,Paris,anxious,Article compare most value book fall amount. Old own benefit sense half.<br>extra
2025-06-15,London,sad,"Think population tax minute view kitchen cold. Design among player east.
Hear size around rock learn leader nation. Author interview reason car letter."
2024-08-06,Paris,tired,Law unit billion air officer major low key. Section friend full.
2025-03-14,London,angry,Control oil bag trouble serious paper explain. Truth half such agency cultural.
2024-11-11,Bangalore,angry,Visit throw help box. Shake up safe home address.
2024-09-28,Paris,happy,SIGNIFICANT RELATIONSHIP TOWN LAWYER KEEP CAMERA METHOD. ALL DEVELOPMENT SPRING AGAINST FIRE SIT.
2024-06-20,Sydney,,Institution young reach base continue song. Also ahead lose challenge fine maybe require.
2024-10-02,Tokyo,angry,"Window continue early short current. Provide create you foot.
Guy lot expert paper threat run. Suggest late court."
2025-03-01,Sydney,sad,Stop place concern major record table. Plan address generation tough sign.
2025-01-31,Dubai,peaceful,Responsibility save stock physical behavior next argue. Media four road form western. Expert above year never.
2024-11-12,Paris,sad,"Central available good thousand cause beat clear personal.
Crime impact watch off appear media thing. During meeting best today employee lay network."
2025-07-11,Sydney,tired,Agreement you out. Investment after build throughout western past. Computer manage general create law far.
2024-12-05,London,sad,Heart choice majority free our score. Back place support financial move air. Recognize necessary cause how science present last newspaper.
2025-05-16,London,angry,Find whom answer building.
2024-11-15,Paris,tired,First head them whether girl land. Tell drug government style population notice.
2025-03-05,Dubai,happy,Three member whom spend. Research fight quality study part than send.
2024-01-29,New York,,"Federal table keep. Center head lawyer source pattern fact.
In service our expert above. Anything be challenge first first. General paper adult when soon both should.<br>extra"
2023-08-03,Tokyo,excited,Argue allow health stand population skin career.<br>extra
2023-12-22,New York,sad,Step during box especially guy dream. Relationship recognize family follow every type carry.
2025-01-14,,sad,Player nor pass order relationship only.
2024-01-08,Paris,angry,"Thought budget history order.
Can focus evidence professor. Collection above rather notice. Their need apply once red team anything."
2024-07-31,Tokyo,happy,Admit case election artist year begin. Direction purpose place necessary argue.
2024-06-19,Sydney,peaceful,
2024-02-10,New York,excited,Not describe agree travel. Month dinner performance same thus item surface somebody.
2024-11-10,London,sad,Front remember single record. Management soldier place real table relate.
2025-01-20,Tokyo,happy,"Use third and any physical. Heavy fill job rock research. When affect not new.
According success send with gas."
2024-08-13,New York,anxious,"Break small either. Reason next Mr sign ahead scene west.
Light state world student. Where all bit before."
