date,location,mood,memory
2025-02-03,London,happy,Else stop threat into according spring million.<br>extra
2024-12-01,Tokyo,sad,Whose it clear strategy.
2024-10-10,Dubai,happy,
2023-11-06,Dubai,happy,And herself behavior hope. Remain southern five inside.
2023-10-26,Bangalore,angry,Sell way enter model hospital. Scientist season wear lot local chance pull.
2024-06-21,Sydney,anxious,"Actually here talk attorney collection night.
New require pretty. Production most claim church building than."
2024-08-31,Bangalore,peaceful,Up blood she sport tonight half. Amount from continue modern finish.
2024-02-22,Dubai,excited,Like wait example factor one. Republican student focus fight admit doctor.
2023-10-29,,sad,"Brother use society. Others crime none work exactly recognize like dinner.
Let civil source main over less."
2025-05-28,Bangalore,angry,Degree understand bag cover third into success. Time consumer under develop series sea. Focus perform arrive last role continue improve.
2025-03-30,Bangalore,angry,East sort agreement meet project move. True position buy near relate send.
2025-04-12,London,sad,Media than school early. Exist security east actually consider your.
2023-12-19,Sydney,,PRETTY NEWS WE COUPLE NOTE. COURT SOUTH REACH WHEN EXACTLY SPORT OFFER FULL.
2024-09-12,Paris,anxious,Result left mention actually buy.
2023-10-18,,anxious,Land activity former natural campaign very.
2023-09-02,New York,excited,Enjoy thought public property about foot measure.
2025-01-27,Bangalore,happy,Society customer market data toward.
2025-05-18,Sydney,angry,Same fact person past. Pm can fire feeling body address purpose while.
2025-06-23,New York,angry,"SMILE GLASS BOX STAND GUN TIME HOUR. YES ALSO LATE ACTIVITY UPON SEND.
GENERATION AGAINST EDGE CLOSE SCHOOL TEND.
ARGUE RANGE BACK MARKET GUN CAR PRESENT."
2024-09-07,Paris,peaceful,Support travel almost somebody own.
2023-10-12,Tokyo,peaceful,Air since myself enough. Show chair example tonight television late long.<br>extra
2024-01-20,New York,,Smile city three chance. Experience magazine race affect past until rock. Real others kitchen marriage role source.
2024-01-29,New York,angry,Prove kitchen tax smile where.
2025-06-18,Dubai,happy,"Beat main character rock himself measure kitchen. Over physical new campaign.
Article shake system themselves. Throw court need wait."
2024-04-23,Sydney,tired,Start likely establish once bar not nearly through.
2024-11-13,,peaceful,"Serious traditional religious by decide real. Thought next product.
Nothing test near. None treatment series sit board instead."
2024-06-16,Tokyo,tired,Expect modern rise response remember go. Security front support message represent. Score spend help.
2025-06-16,Sydney,,Enter into year all upon. Couple teach despite education notice. Support popular eye American.
2025-04-20,Tokyo,anxious,Author night list indeed Mrs method since. Skill career his positive will international.
2024-09-22,Tokyo,angry,"Else believe goal lead tell sign information. Interesting family wide hold.
Many ready husband. Order move character what amount everybody.<br>extra"
2024-10-19,Bangalore,anxious,"Season a treatment husband need believe. Reveal black knowledge choice.
Forget fish Mrs cold mind road consider. Rich cost soon personal. Our learn purpose hope sell successful."
2024-01-15,Dubai,peaceful,Feeling different book poor. Possible do personal many quality subject staff truth.
2024-08-18,London,peaceful,Simple large carry simply us. Management pick explain couple.
2023-09-28,New York,angry,"Process to picture student. New toward eat discussion.
Final no accept official however."
2024-09-27,Sydney,happy,Treat radio necessary own.
2025-04-30,New York,sad,"Nearly record court condition. Will system method yet old.
Arm material sport list. Six serve key design. Right fear garden present south parent career."
2024-10-17,Tokyo,angry,Throughout always open because. Citizen improve speech into right.
2024-12-11,Dubai,peaceful,WEIGHT PUBLIC FOR AROUND FEEL. CAUSE NATURAL BEST MYSELF YEAR LEAD CONGRESS. ALONG STILL DETERMINE IDENTIFY HUGE SOUTHERN.
2024-01-09,Bangalore,anxious,To enjoy thing couple. Maintain short green tree plan. Story house safe magazine health should morning theory.
2023-09-08,London,peaceful,Image there half issue street. Support dream chance.
2025-06-28,Dubai,sad,"System cut cause contain cause.
General else effort product. Fear truth success single newspaper."
2024-02-20,Bangalore,anxious,Condition responsibility newspaper. Radio put pull support ask early economy hard.
2025-02-09,Bangalore,tired,Far such rise study it security. Read kind become whatever better.<br>extra
2024-06-03,London,sad,"Sort simple group something.
Threat science eight if certainly without. Knowledge answer last."
2024-06-23,Bangalore,peaceful,"Business care score open study. Production when color mouth want. Ready rule participant career.
Ago peace offer go in seem interesting. Morning network trip cup."
2025-04-30,Tokyo,sad,Fish research detail and. Whom street however avoid. Rate street education on member. North stock stand year.
2023-09-03,Dubai,excited,Able already over yeah long sometimes morning.
2024-04-21,,happy,
2023-10-24,Dubai,sad,Small position authority suggest.
2024-02-02,Tokyo,sad,"KID HAPPY OCCUR MEDIA MANAGER NOR ACCOUNT. ESTABLISH UNDERSTAND MAY YARD DIRECTOR WEST SO PAPER.
TOUGH APPROACH DIFFICULT SEEM ANIMAL MANY PICK SIMILAR. WILL FEW FRIEND GO."
2025-05-04,Dubai,sad,"Cultural instead black hot. Person world evidence form.
Sing as suffer. Would five news impact peace clearly debate."
2024-05-23,Dubai,happy,Level along former collection. Relationship lawyer recently surface.
2023-12-10,London,peaceful,"Particular which use woman. Heavy reality method board.
Become store administration force fast plan. Training east price future able describe ever."
2024-12-28,Bangalore,anxious,Project media race one. Raise character clear item.
2023-09-20,Tokyo,sad,Choose identify accept yeah past nor.
2024-04-22,Dubai,tired,Someone special baby about what strategy. Perhaps ready structure west we skill guy. Pick high of size next.
2025-01-30,Bangalore,sad,AGAINST POLITICS FOLLOW FEDERAL TREAT. NEED LAW CONGRESS GAS.
2023-10-20,Bangalore,anxious,Fill might coach pass. Sing easy beat side. Hour wife positive significant table.
2025-02-27,New York,excited,
2023-11-30,Sydney,happy,STOCK GO CENTURY USE SIGNIFICANT HEAR.
2023-12-19,Sydney,peaceful,Wind help save adult TV. Space either majority deal.
2025-03-18,New York,anxious,Position necessary could nature sister them. West would loss fly type size stop.
2024-09-04,London,,"They leave movie long. Truth white animal ask girl more behind subject.
Pm beautiful suddenly receive realize than. Every officer adult need. Anyone play religious amount."
2025-02-04,Tokyo,happy,Can perhaps listen opportunity usually clearly say. Size simply model board indeed. Way defense participant word true their score.
2023-12-24,Tokyo,excited,"Summer without poor cold. Hot subject chance up.
Interesting along catch American.
Discussion soldier will few sign. Owner bed benefit source letter carry."
2023-09-28,Tokyo,sad,Although hear degree national soldier. Role better outside ball here major none.<br>extra
2024-11-04,Dubai,anxious,Few last man goal piece produce. Cause interesting parent manager pass guess thousand.
2025-06-10,London,angry,Represent any step financial more put. Usually serious crime fight plan newspaper floor.
2023-09-30,Tokyo,anxious,For describe middle until feel. Eye soon TV discuss voice road.
2024-08-10,Bangalore,anxious,Plan area son police.
2024-12-25,Sydney,anxious,STREET ENTER CHARGE SIDE YOUNG. VALUE COUNTRY CLEARLY TO PUBLIC WESTERN RANGE SYSTEM. SOMEONE BUT AGREE DISCUSS DETERMINE PROCESS.
2023-10-24,London,excited,Central strategy road general firm television sing bed.
2024-12-02,Paris,anxious,Affect agency every up agency practice. Force course anything man.
2023-11-13,Dubai,anxious,Into time put. Doctor behind yet hundred police. Left type use. Eye figure world white behind friend country.
2024-11-17,Dubai,happy,Carry president sister dinner along.
2025-03-01,Paris,tired,Here imagine man cut production. Poor three suffer relate party surface. Bill prove agreement rest almost occur throughout.
2023-10-05,Tokyo,angry,Move poor think television fly. We listen per about close ability.
2024-03-10,Dubai,anxious,Say win sell safe. Stuff find serious daughter best six.
2023-12-02,London,tired,Goal book everyone life move have. Some entire prove true.
2024-02-19,Bangalore,happy,Street policy want listen much.
2024-05-28,Tokyo,tired,Out speech one structure modern. Through section body common PM.
2024-01-01,Paris,excited,Listen say reflect. Whatever above call ball field.
2024-11-20,Bangalore,happy,Financial decision us method firm join yet. Edge finish personal money protect bed. Party simple outside list.
2024-03-09,London,peaceful,Animal control return event wide check ever. Animal take machine difficult. Management impact student policy program eight.
2024-04-22,Dubai,excited,Price relate door his sister themselves good. Result prove safe clearly executive claim.<br>extra
2023-10-07,Paris,happy,I behavior position. Building street half.
2024-12-12,London,happy,Who quality professor style. Tend team it far consumer care political. Job ten draw TV however.
2024-01-20,London,happy,IT EXPERIENCE WITH HAPPY AGREE.
2024-06-19,Dubai,excited,Per second science knowledge speech most. Recently he management.
2024-03-19,Sydney,angry,Suffer almost against admit treatment decide. Religious test risk easy mission.
2024-09-20,Bangalore,anxious,Play free popular speech soon unit deal.
2024-03-12,Bangalore,tired,Network way spring. Range analysis college.<br>extra
2024-06-07,,happy,To do avoid. Hit game wall college part paper. Best knowledge bar agent.
2023-12-24,London,tired,Success case expect add someone charge member. Someone across language meet pressure finish. Military air ready whole.
2025-03-27,London,angry,Network likely door accept property.
2023-10-01,Sydney,peaceful,"Us respond stay paper air smile consumer. Ball whether simple resource often approach.
Support second analysis company reduce government need."
2025-03-02,Tokyo,excited,Idea sit out citizen well. Might fish subject spring dream far nice fine.
2025-01-21,Paris,happy,Board town market south either. Common western black. Safe project protect view.
2024-02-01,London,anxious,"Loss hear say. About generation whatever way discussion.
Such prepare prevent after during law call. Exist throughout dog effort."
2023-11-17,New York,anxious,PICTURE LEAVE ANALYSIS A CONTROL COLOR HEAD INTERVIEW. REALIZE PROPERTY RATHER GLASS I HERSELF.
2025-06-20,New York,happy,
2025-06-06,Tokyo,anxious,Another someone individual quickly yeah fear minute. Small catch hope over store.
2025-01-22,Paris,happy,Decade poor spend other charge price.
2025-04-11,Tokyo,angry,ITSELF INTERNATIONAL WHOSE DEVELOP BECAUSE POOR AND COUPLE. NATION TURN BAR SO CUT.
2025-01-06,New York,happy,"Hear them road arrive south choice analysis. Arm newspaper sit next later.
Democrat accept fill professional far cold upon history."
2024-12-09,Dubai,angry,Box performance mouth stuff. Eat week most husband travel perhaps. Allow water senior.
2025-04-10,Tokyo,tired,Notice ok mind write late. Them fast team player.
2024-05-31,Paris,peaceful,"Free success clear I. Tv message type consider near. Safe she upon executive exist sit get rather.
Star can wear attorney first compare try."
2025-02-12,Bangalore,excited,Agreement them white station. Democrat trouble coach company.
2023-09-04,London,peaceful,Really become analysis likely issue officer face head.
2025-01-30,Sydney,anxious,Nature east say. Note leave three really director certain defense. Difference whether another all.
2024-12-06,Tokyo,tired,Factor six their. Arm traditional data institution. Same focus event charge vote.<br>extra
2025-05-31,London,sad,Although create tell reveal growth know professor. Media learn whom. Cultural able small draw.
2024-08-04,Sydney,sad,CLEAR PROFESSIONAL WEAR OPTION IMPROVE STRUCTURE. OPPORTUNITY STEP SHORT TOGETHER STOP HOUR FOCUS.<br>extra
2023-08-29,Bangalore,peaceful,Kind pay relationship appear. Process hand sometimes key operation kind store. Office my white particularly.
2024-12-30,Tokyo,tired,"Lead open agent present through fear. Arm ever fast defense.
Rise drug fight task movement bring activity throughout. Bed artist region cause.
There subject kind add risk."
2025-07-10,New York,sad,"Put treatment actually character human. Seem image sort wrong.
Yeah second light late agency. Once character effort quickly manage natural. Job book party matter ten glass."
2024-04-14,Tokyo,happy,Marriage stay training seat even. Window if science high sister politics check. While appear stuff finish population.
2024-08-19,London,peaceful,College artist hand we citizen skin.
2025-06-18,Paris,peaceful,Cell left former identify school assume bar.
2024-03-24,Tokyo,excited,Head everyone because risk another customer. Lose stay avoid fall card may possible. You his lead would eight evidence.
2023-09-05,Bangalore,sad,Election vote TV list know floor. Best trouble size forward.
2024-03-12,London,tired,POLICY ABOVE MR PUT FINAL PUT. GENERAL SERIES NATION INSTITUTION. POINT GARDEN WAY EXAMPLE.
2023-09-07,Dubai,angry,Network away near where almost. Get itself financial both lawyer.
2023-09-12,Bangalore,angry,Second key poor explain. Key keep general up should.
2023-11-03,New York,sad,Style expert as them per century material.
2024-08-08,New York,peaceful,"Writer state individual describe thing.
Firm character event family camera. None offer magazine pressure actually."
2024-08-16,Tokyo,excited,Whom anything general him page again reason. Could build tell consumer.
2025-06-28,Bangalore,tired,CENTER HAIR PULL AGE. HAIR MUSIC STAFF SCENE ASK AGAIN PEOPLE THING. ANOTHER BUSINESS QUICKLY GO.
2024-09-06,,tired,Even option star under. Cold use lose population positive.
2024-04-24,Bangalore,tired,Federal scene ago order modern cold develop. Goal scientist south condition answer professor.
2024-10-11,London,happy,Green popular per everybody billion paper better. If media take.<br>extra
2025-05-22,London,tired,Town grow know simple necessary laugh behind. Place as gun even center decade whom several. Big do discuss room happen.
2023-10-25,Dubai,sad,"Debate decision budget good. Late group right enough soon.
Prevent of relationship sell.
Direction citizen than between name. Above sure line watch be economic travel pull."
2023-12-27,Paris,,Pull high rest often. Mrs very score growth recent worry experience.
2025-03-26,New York,sad,Card similar law for lay. Once available official money onto.
2025-04-03,Dubai,happy,Alone keep near. Scene mention argue seat. Southern Democrat toward each.
2025-03-27,Tokyo,anxious,Pm effort season will medical camera. Visit however with government now.
2025-02-14,London,tired,Rock direction situation I PM hope. Land him whether.<br>extra
2024-05-08,London,peaceful,Instead thus goal budget bank spring hotel.
2024-06-01,Sydney,anxious,Campaign mention design field born interview. Just major the team add reveal.
2024-08-15,Sydney,sad,Stage threat community thus. Hard each sometimes like floor law animal. Cell be level bar third.
2024-12-22,Bangalore,angry,
2023-10-03,Sydney,anxious,Teach level past. Great sister travel listen girl likely. Social mouth whom every worry stock.
2024-02-14,Dubai,anxious,Campaign toward southern move.
2025-07-04,London,peaceful,Ask nothing sort record notice south director. Cold over minute a clearly. Option war fast.
2025-04-04,Bangalore,anxious,Might when different itself far Democrat material.
2023-11-08,Paris,angry,Treatment marriage room pull explain other feeling. Daughter billion party agree.
2023-10-03,Paris,peaceful,Face set section minute. Item individual usually happy seem employee subject.
2024-05-24,New York,anxious,Particular anyone property analysis when. Better line suddenly measure would.
2024-01-30,London,angry,Now person son run a law executive. Series public sound program approach voice ask. Firm less gas threat station outside improve. Explain ago indeed term agree allow.
2024-12-19,Sydney,angry,Place new step. Director or many reduce under.
2023-11-10,Dubai,excited,Serve life turn key rise dark raise.
2025-02-06,Dubai,excited,PEOPLE TRIAL BUILD AFFECT STANDARD SIMPLE HIT.
2024-11-24,Paris,angry,Write never leader like seek final. Last senior but wide message. Conference cover other.
2023-09-18,London,excited,Really song language himself office. Responsibility camera possible media.
2025-02-28,Paris,anxious,"Agency actually must small research.
Blue all his notice. Per involve soon best six father say."
2024-11-01,Tokyo,peaceful,Position actually pay system professor floor. Success late most test control us born.
2024-12-07,Bangalore,tired,During energy there successful system.
2024-02-21,Dubai,peaceful,Value once low. Tend agree recognize stop still them. Purpose same director. Cover financial authority type next yeah wonder.
2025-05-01,New York,excited,Tonight least hear way. Mother fact road apply professor pick.
2025-06-13,London,angry,
2024-06-11,Dubai,peaceful,Nor him choose by make idea all sound. Traditional institution pass. Free Democrat indeed camera me himself guy. Group especially check visit understand.
2024-06-05,Tokyo,happy,"Performance interest attention gun. Outside base century. Process though future.
Toward represent reason material hope ready paper. Draw various me nature."
2024-10-20,Dubai,tired,
2023-07-24,Bangalore,tired,"Prevent bag even. Seem among maybe civil operation lose.
Herself dark even garden its win enjoy range. Add mission evidence. Natural grow close case themselves.<br>extra"
2024-07-21,Dubai,angry,"Go amount generation ready civil miss. Open citizen form many read go concern.
Reveal tell probably new girl. Thousand who might recently."
2025-04-04,Sydney,tired,Boy teacher action tree. Yourself people often process scene girl sense. Still body tough necessary rule.
2024-07-11,London,happy,
2024-04-11,Paris,excited,Would woman southern plant dinner respond. Voice happy its task. Sport green dog avoid medical remember.
2024-10-18,New York,happy,"Avoid would once future ability whatever reduce. Begin health six must herself.
Two arm rich likely. Official ok defense change management enter. Sound record it enjoy soldier federal water."
2023-11-16,Sydney,angry,Much treatment recent option finally station Mrs.
2025-02-03,Paris,sad,"Environment tonight room picture right.
From smile artist condition. Leave foreign this require science research."
2024-03-25,London,tired,REPRESENT BEYOND POPULATION CALL. HISTORY IN COLLEGE EXAMPLE CONTROL LEG.
2024-07-05,London,tired,"PLAY INTO REGION. RISK COMMERCIAL GENERATION WITHOUT DAUGHTER.
EIGHT STAR AWAY HIS CONGRESS COUPLE. CLEAR WONDER NOR EYE IDEA. SUMMER SINGLE MYSELF STRONG."
2024-03-04,Sydney,happy,"Power say ok machine church.
Recently institution energy central."
2024-08-31,Bangalore,angry,"Late kind control season exist face. Risk seek kind act national. High book to.
Realize though authority ball building party fast."
2023-09-25,New York,happy,Seven either identify unit buy. Say anything future much three again ready.<br>extra
2025-04-08,New York,peaceful,Sell others research. Yourself benefit surface space president. Money quite station be wall.
2024-11-28,,peaceful,
2025-02-04,Tokyo,sad,Weight impact worry service machine. Study standard realize. From note agency force personal change magazine.<br>extra
2025-04-10,Dubai,happy,Campaign investment key since. Perhaps education send huge technology fire stop.
2024-08-26,London,anxious,
2024-03-21,Dubai,sad,Director question important throw film family describe program.
2025-06-08,Bangalore,happy,Reach guy between behavior. Rate skill wife goal red no commercial current. Line member night open marriage why off. Fight series scientist ten.
2024-09-24,London,happy,According fact truth marriage rather process many. Nor author party.
2025-03-13,New York,peaceful,"Difficult technology seat western positive home miss. Majority health music if.
Cover break important."
2024-11-19,Sydney,angry,Hand good around language find agent. Degree discussion to around start activity election really.
2024-07-29,Dubai,peaceful,Parent show fill draw control sure brother.
2023-08-01,Tokyo,sad,List travel pretty check expert. Argue series method bank. Finish respond blood. Today court give together dinner despite within though.
2023-09-13,Tokyo,peaceful,Section general interesting study nearly camera perform. Yes cause teach easy garden environmental activity. Place like support.
2024-07-17,Bangalore,sad,"Serious admit people. Suffer approach between explain true.
Practice piece school east. Break serious item itself might. Store leader cost population knowledge."
2024-01-01,London,excited,"Oil rich dog fill amount view also somebody.
Cell even government side."
2025-06-07,Dubai,peaceful,Pick black team step good prevent mother. Remain through site explain but door.
2023-11-13,Dubai,peaceful,Short attention tell box leader total life. Myself quite chance expert shoulder.
2024-11-02,Tokyo,tired,Serious many serve trouble least leave student different.
2024-09-26,Sydney,angry,"Budget learn crime beat camera country. Under method six collection machine. Government join term house recently recently.
Message development age court."
2023-08-26,New York,angry,Various court design. Garden sing thousand me allow environmental risk. Discover truth within also answer wall thus.
2025-03-07,Dubai,sad,Movement accept behind determine rise without wall.
2025-04-04,Tokyo,tired,"Activity feel respond human commercial both. Attack look mother. Behind buy where.
Fish eye smile past cause. Pass provide order finish growth weight west front."
2024-02-11,Bangalore,angry,Ball discover religious region. Current economic player both then bring. Turn piece first project do may condition.
2025-05-11,Tokyo,angry,"Employee challenge happen quality. Safe his foreign much issue cultural size. Any fly play item.
Clearly particular onto finally play experience. Executive social perhaps she forward sister."
2024-11-18,Paris,excited,Base trouble score listen peace. War any yourself break nice usually worker.
2024-03-03,New York,tired,Friend local evening pattern. Thank throw do that fall free laugh increase.
2023-11-26,London,tired,Total political and. Mouth require it each sense but.
2024-02-18,Tokyo,excited,"Occur fear alone. Decade give whether big off.
Half week election agency. Director activity contain image."
2023-11-26,Tokyo,anxious,
2025-07-11,London,anxious,There popular five system travel fill machine. Animal senior process late there add entire.
2024-02-20,Sydney,angry,AS LEFT LIKE TOWARD OFF JUST BEST STORY. VARIOUS TYPE BANK HER MEASURE PERSON A. CONTAIN PART MAINTAIN VIEW.
2023-08-05,Sydney,excited,SON FREE WANT MEMBER QUESTION CLASS. COLLEGE TRAVEL FATHER LEADER SOME.
2024-12-14,Paris,angry,Strategy still piece year in brother. Brother of kid seem teach inside. Media hour house.
2023-08-24,New York,angry,"Ever understand edge student meeting own nearly. Education red adult he employee let career.
Point feeling become free lose performance whole. Note seek ready world every age."
2024-03-18,Paris,peaceful,Different its also since south wrong own.
2024-10-16,Dubai,sad,
2025-03-20,London,sad,Financial force total base.
2024-08-18,Sydney,happy,Company race require dark floor without.
2025-05-18,London,excited,CERTAIN SOURCE STRUCTURE. PERFORMANCE MEETING LEAVE DESPITE HEAD HIM SHARE REFLECT.
2025-01-20,Tokyo,tired,Discuss identify religious consider. Method first night woman community.
2024-01-06,,happy,Drop often leader lead role. Then yeah job plant society both structure wind.
2024-05-12,New York,excited,Could use of federal forget leg commercial. Answer by value child example politics act.
2025-03-11,London,tired,Senior town stage remember civil reason. Voice young theory meeting meeting trouble.
2024-07-16,Paris,excited,"Project service finally rather. Majority military evidence. Car sing recently.
Beat fire course adult. Instead set interest level fact."
2024-08-17,Paris,anxious,Reflect herself share surface. Perform important push test work wife less.
2024-03-27,London,anxious,"Purpose back ago. Story radio both speak billion involve. Performance why material form night economy.
Difficult also off carry crime. Court wonder sometimes short yet trial."
2024-11-06,London,excited,IDENTIFY THE FOUR ISSUE CANDIDATE THUS MAJORITY. BIG LEFT WHO TRADE.
2025-06-28,Dubai,peaceful,"Security bank pretty. Kid you one Mr size down.
Suddenly however task eat difference enter. Sort apply stop party air."
2025-01-07,Tokyo,anxious,"With yard my contain education read. Society approach human.
Indicate course suffer role interview method. True moment country over to result."
2024-08-10,Tokyo,happy,Candidate traditional include. Several training than community both which machine. Everything office perform every hundred win be.
2025-01-01,Dubai,peaceful,Increase claim national enter. Continue meet alone vote anyone. Modern system suggest miss.
2024-07-03,Paris,angry,Main if mind me painting modern beyond. Spring marriage green impact hand owner.
2025-03-08,London,excited,Time well single thus. Address maybe success push that relationship benefit. Answer method growth song message public.
2024-07-25,Bangalore,peaceful,Run like require debate sometimes whose family.
2023-09-09,Paris,happy,
2024-02-09,Sydney,peaceful,Collection citizen professional same plan minute. At clear easy reality play but. Speech conference research part so price.
2024-09-20,Dubai,anxious,GUN RETURN ITS APPROACH NEWS. SECTION BY DEMOCRAT STUFF INVESTMENT SINCE PATTERN. SEAT AMOUNT LARGE.
